,index,date,name,lesson_name,item_number,transcript,wb_message_count,is_chatbot,team,teacher_handle,student_handle,type_boolean,number_of_interactions,active_session
0,1857,9/5/2018,Dominique Huffman,Visualizing Place Value Relationships,3026600,"Server Notice @ [2018-09-05T18:37:22.508Z]: This conversation will be saved.
Server Notice @ [2018-09-05T18:37:22.508Z]: Your device supports Web RTC audio
Ms. Dominique @ [2018-09-05T18:37:22.509Z]: Hi! Let's look over your problem again. Would you like me to type or talk?
Kylie @ [2018-09-05T18:37:53.777Z]: hi
Ms. Dominique @ [2018-09-05T18:37:59.499Z]: Hi
Ms. Dominique @ [2018-09-05T18:38:13.635Z]: What number does the model represent?
Kylie @ [2018-09-05T18:40:19.304Z]: 4 tens 7ones
Ms. Dominique @ [2018-09-05T18:40:30.896Z]: That's right very good
Ms. Dominique @ [2018-09-05T18:40:42.013Z]: So what value does the 4 in that number represent?
Kylie @ [2018-09-05T18:41:10.455Z]: 8
Ms. Dominique @ [2018-09-05T18:41:39.818Z]: Please explain how you got 8?
Kylie @ [2018-09-05T18:42:05.722Z]: i counted
Ms. Dominique @ [2018-09-05T18:42:18.366Z]: what did you count?
Kylie @ [2018-09-05T18:43:32.137Z]: i said 4 in my head
Ms. Dominique @ [2018-09-05T18:43:50.747Z]: OK so there are 4 of those blocks and each one has 10 small squares in it
Ms. Dominique @ [2018-09-05T18:43:53.592Z]: What is 4 groups of 10?
Kylie @ [2018-09-05T18:44:17.654Z]: 40
Ms. Dominique @ [2018-09-05T18:45:04.059Z]: very good, so that 4 has a value of 40
Kylie @ [2018-09-05T18:45:16.696Z]: ok
Ms. Dominique @ [2018-09-05T18:45:46.392Z]: Do you have any questions before you continue on your own?
Kylie @ [2018-09-05T18:46:04.766Z]: no
Ms. Dominique @ [2018-09-05T18:46:13.558Z]: Please come back if you need more help. Have a nice day!",0,no,6,Ms. Dominique ,Kylie ,True,8,True
1,1796,9/18/2018,Dominique Huffman,Introduction to Dividing Whole Numbers - Standard Algorithm,32023,"Server Notice @ [2018-09-18T19:08:05.116Z]: This conversation will be saved.
Ms. Dominique @ [2018-09-18T19:08:05.117Z]: Hi! Let's look over your problem again. Your device does not support chat audio. We need to type. Ready?
Angelique @ [2018-09-18T19:08:34.723Z]: Hi
Angelique @ [2018-09-18T19:08:44.494Z]: Dominique
Angelique @ [2018-09-18T19:09:21.421Z]: Sorry
Ms. Dominique @ [2018-09-18T19:09:28.693Z]: HI :)
Ms. Dominique @ [2018-09-18T19:09:34.586Z]: How much total money is being split in this problem?
Angelique @ [2018-09-18T19:10:25.513Z]: $95
Ms. Dominique @ [2018-09-18T19:10:49.877Z]: that's right
Ms. Dominique @ [2018-09-18T19:10:53.140Z]: and how many friends are sharing it?
Angelique @ [2018-09-18T19:11:14.068Z]: after can we talk about something else
Ms. Dominique @ [2018-09-18T19:11:30.140Z]: just for a minute but then I have to go help other students with math
Angelique @ [2018-09-18T19:11:37.038Z]: $10bilss
Ms. Dominique @ [2018-09-18T19:12:06.217Z]: how many friends are sharing the money?
Angelique @ [2018-09-18T19:13:20.402Z]: 4 friends
Ms. Dominique @ [2018-09-18T19:13:27.283Z]: right
Ms. Dominique @ [2018-09-18T19:13:33.243Z]: So first lets split up the 10
Ms. Dominique @ [2018-09-18T19:13:36.898Z]: How many tens are in 95 ?
Angelique @ [2018-09-18T19:14:33.079Z]: 9
Ms. Dominique @ [2018-09-18T19:14:50.256Z]: that's right
Ms. Dominique @ [2018-09-18T19:14:56.246Z]: So what is 9 tens split among 4 friends?
Angelique @ [2018-09-18T19:15:43.716Z]: 20 for each
Angelique @ [2018-09-18T19:16:22.011Z]: Hello?
Ms. Dominique @ [2018-09-18T19:16:24.267Z]: Right!
Ms. Dominique @ [2018-09-18T19:16:30.198Z]: So each friend will get how many $10 bills?
Angelique @ [2018-09-18T19:16:38.587Z]: 2
Ms. Dominique @ [2018-09-18T19:16:53.462Z]: that's right
Ms. Dominique @ [2018-09-18T19:17:01.457Z]: And how many $10 bills are being used so far?
Angelique @ [2018-09-18T19:17:31.032Z]: I wish I can see you👀 you seem kinda nice
Angelique @ [2018-09-18T19:17:54.899Z]: How old are you
Ms. Dominique @ [2018-09-18T19:18:06.921Z]: Thanks :)
Angelique @ [2018-09-18T19:18:07.324Z]: Hello
Ms. Dominique @ [2018-09-18T19:18:07.776Z]: Do you think you have it from here?
Angelique @ [2018-09-18T19:18:19.798Z]: No !!!,
Angelique @ [2018-09-18T19:18:41.679Z]: I don’t get you
Angelique @ [2018-09-18T19:18:54.598Z]: You want me to leave
Ms. Dominique @ [2018-09-18T19:19:02.905Z]: Please answer my questions so I can help you with this problem.
Ms. Dominique @ [2018-09-18T19:19:06.539Z]: And how many $10 bills are being used so far?
Angelique @ [2018-09-18T19:19:23.498Z]: Are you getting mad 😡
Angelique @ [2018-09-18T19:19:34.419Z]: Bye
Ms. Dominique @ [2018-09-18T19:19:45.505Z]: Please come back if you need more help. Have a nice day!
Angelique @ [2018-09-18T19:19:50.191Z]: No
Angelique @ [2018-09-18T19:20:02.024Z]: I’m ready to learn",0,no,6,Ms. Dominique ,Angelique ,talk,12,True
2,46,9/12/2018,Dominique Huffman,Visualizing Rounding,30289,"Server Notice @ [2018-09-12T17:11:43.159Z]: This conversation will be saved.
Ms. Dominique @ [2018-09-12T17:11:43.160Z]: Hi! Let's look over your problem again. Your device does not support chat audio. We need to type. Ready?
Madison @ [2018-09-12T17:12:47.952Z]: How doe you do it
Ms. Dominique @ [2018-09-12T17:13:07.654Z]: Well what number are we rounding to the tens place?
Madison @ [2018-09-12T17:13:48.087Z]: What doe you mean
Ms. Dominique @ [2018-09-12T17:14:09.445Z]: I mean the problem asks us to round something to the nearest ten
Madison @ [2018-09-12T17:14:46.953Z]: Thank you for hellping me
Ms. Dominique @ [2018-09-12T17:15:07.229Z]: You're welcome
Ms. Dominique @ [2018-09-12T17:15:09.012Z]: Do you think you have it from here?
Madison @ [2018-09-12T17:15:17.033Z]: No
Ms. Dominique @ [2018-09-12T17:15:26.696Z]: What number does the problem say to round to the tens place?
Madison @ [2018-09-12T17:16:36.596Z]: 77
Ms. Dominique @ [2018-09-12T17:16:59.048Z]: you mean 67 ?",0,no,6,Ms. Dominique ,Madison ,True,5,True
3,6311,9/4/2018,Dominique Huffman,Operations with Whole Numbers - Mixed Practice ,4590,"Server Notice @ [2018-09-04T17:15:40.911Z]: This conversation will be saved.
Server Notice @ [2018-09-04T17:15:40.912Z]: Your device supports Web RTC audio
Ms. Dominique @ [2018-09-04T17:15:40.913Z]: Hi! Let's look over your problem again. Would you like me to type or talk?
Jayce @ [2018-09-04T17:15:54.177Z]: type
Ms. Dominique @ [2018-09-04T17:15:58.015Z]: How many total *packs* of cards did Sara buy at both stores?
Jayce @ [2018-09-04T17:16:14.386Z]: ?
Ms. Dominique @ [2018-09-04T17:16:31.595Z]: Well how many packs did she buy at the first store?
Jayce @ [2018-09-04T17:16:36.359Z]: 6
Ms. Dominique @ [2018-09-04T17:16:49.209Z]: Good, and how many at the second store?
Jayce @ [2018-09-04T17:16:54.606Z]: 5
Ms. Dominique @ [2018-09-04T17:17:14.059Z]: Excellent, so how many total packs did she get at both stores put together?
Jayce @ [2018-09-04T17:17:23.574Z]: 11
Ms. Dominique @ [2018-09-04T17:17:42.195Z]: Very good
Ms. Dominique @ [2018-09-04T17:17:48.289Z]: Now how many cards are inside of each pack?
Jayce @ [2018-09-04T17:17:51.108Z]: :)
Jayce @ [2018-09-04T17:18:00.112Z]: 17
Ms. Dominique @ [2018-09-04T17:18:10.385Z]: right
Ms. Dominique @ [2018-09-04T17:18:17.534Z]: So how can we find the total number of cards in all 11 packs?
Jayce @ [2018-09-04T17:18:37.541Z]: 11 times 17
Ms. Dominique @ [2018-09-04T17:19:02.449Z]: exactly
Ms. Dominique @ [2018-09-04T17:19:03.536Z]: Do you have any questions before you continue on your own?
Jayce @ [2018-09-04T17:19:14.612Z]: na
Jayce @ [2018-09-04T17:19:24.356Z]: bye than
Ms. Dominique @ [2018-09-04T17:19:24.359Z]: Please come back if you need more help. Have a nice day!",0,no,6,Ms. Dominique ,Jayce ,True,8,True
4,350,9/18/2018,Dominique Huffman,Absolute Value I,4636,"Server Notice @ [2018-09-18T18:55:06.991Z]: This conversation will be saved.
Server Notice @ [2018-09-18T18:55:06.992Z]: Your device supports Web RTC audio
Ms. Dominique @ [2018-09-18T18:55:06.993Z]: Hi! Let's look over your problem again. Would you like me to type or talk?
Damaris @ [2018-09-18T18:55:14.913Z]: helloo
Ms. Dominique @ [2018-09-18T18:55:21.911Z]: What does |a| and |b| mean?
Damaris @ [2018-09-18T18:55:54.301Z]: idk
Ms. Dominique @ [2018-09-18T18:56:28.175Z]: Well do you know what the straight brackets || mean?
Damaris @ [2018-09-18T18:56:35.936Z]: noo
Ms. Dominique @ [2018-09-18T18:57:04.829Z]: That means 'absolute value'
Ms. Dominique @ [2018-09-18T18:57:13.012Z]: How do you find the absolute value of a number?
Damaris @ [2018-09-18T18:57:21.062Z]: idk
Ms. Dominique @ [2018-09-18T18:58:02.118Z]: Absolute value means the distance a number is from 0 on a number line
Ms. Dominique @ [2018-09-18T18:58:09.358Z]: For example, how far is the number 3 from 0 on a number line?
Ms. Dominique @ [2018-09-18T19:01:46.281Z]: I haven't heard from you in a few minutes... Are you still there?",0,no,6,Ms. Dominique ,Damaris ,True,4,True
5,5219,9/20/2018,Dominique Huffman,Dividing Whole Numbers - Two-Digit Divisors,94278,"Server Notice @ [2018-09-20T15:06:52.807Z]: This conversation will be saved.
Server Notice @ [2018-09-20T15:06:52.808Z]: Your device supports Web RTC audio
Ms. Dominique @ [2018-09-20T15:06:52.808Z]: Hi! Let's look over your problem again. Would you like me to type or talk?
Naiella @ [2018-09-20T15:07:10.156Z]: type
Ms. Dominique @ [2018-09-20T15:07:18.025Z]: How do we check our answer to a division problem?
Naiella @ [2018-09-20T15:07:28.378Z]: multiple
Ms. Dominique @ [2018-09-20T15:08:22.117Z]: that's right, Let's take a look at an example together.
Ms. Dominique @ [2018-09-20T15:08:39.483Z]: what number goes in that missing blank?
Naiella @ [2018-09-20T15:09:11.552Z]: 4
Ms. Dominique @ [2018-09-20T15:09:24.788Z]: right very good
Ms. Dominique @ [2018-09-20T15:09:30.037Z]: What multiplication sentence can we write in the same fact family?
Naiella @ [2018-09-20T15:09:30.508Z]: kk
Naiella @ [2018-09-20T15:10:43.564Z]: 21 times 4
Ms. Dominique @ [2018-09-20T15:10:55.379Z]: Right!
Ms. Dominique @ [2018-09-20T15:11:04.125Z]: What does that equal?
Naiella @ [2018-09-20T15:11:06.484Z]: 84
Ms. Dominique @ [2018-09-20T15:11:23.987Z]: that's right
Ms. Dominique @ [2018-09-20T15:11:39.624Z]: Can we multiply 21x4 in a different order and still get 84?
Naiella @ [2018-09-20T15:12:08.701Z]: yes 4 times 21
Ms. Dominique @ [2018-09-20T15:12:13.494Z]: Right very good
Ms. Dominique @ [2018-09-20T15:12:38.199Z]: So now we have three equations in the same fact family. Now let's say I replace one of the numbers with the variable 'N'
Ms. Dominique @ [2018-09-20T15:12:49.776Z]: What number did I replace with N ?
Naiella @ [2018-09-20T15:13:00.371Z]: 4
Ms. Dominique @ [2018-09-20T15:13:35.114Z]: Good
Ms. Dominique @ [2018-09-20T15:13:56.728Z]: So what multiplication problems are in the fact family with '84÷ N = 21'?
Naiella @ [2018-09-20T15:15:11.432Z]: i did the problem and got it right i dont need u any more
Ms. Dominique @ [2018-09-20T15:15:16.670Z]: Please come back if you need more help. Have a nice day!
Naiella @ [2018-09-20T15:15:22.174Z]: bye sorry
Naiella @ [2018-09-20T15:15:26.957Z]: kk",121,no,6,Ms. Dominique ,Naiella ,True,8,True
6,2347,9/6/2018,Dominique Huffman,Adding and Subtracting Decimals,94207,"Server Notice @ [2018-09-06T20:30:36.591Z]: This conversation will be saved.
Ms. Dominique @ [2018-09-06T20:30:36.592Z]: Hi! Let's look over your problem again. Your device does not support chat audio. We need to type. Ready?
Kelijah @ [2018-09-06T20:30:55.975Z]: ok
Ms. Dominique @ [2018-09-06T20:31:01.764Z]: What subtraction problem is being solved here?
Kelijah @ [2018-09-06T20:32:57.902Z]: 9 subtract 8.4 equel 6 and why six is incorect.
Ms. Dominique @ [2018-09-06T20:33:13.046Z]: That's right
Ms. Dominique @ [2018-09-06T20:33:28.542Z]: So about how far apart do you think 9 and 8.4 are?
Kelijah @ [2018-09-06T20:33:32.658Z]: and i dont get it
Ms. Dominique @ [2018-09-06T20:33:44.222Z]: well what is the whole number part of 8.4 ?
Kelijah @ [2018-09-06T20:34:02.679Z]: 84
Ms. Dominique @ [2018-09-06T20:34:16.483Z]: no what number is in the ones digit of 8.4 ?
Kelijah @ [2018-09-06T20:34:29.754Z]: 8
Ms. Dominique @ [2018-09-06T20:34:36.858Z]: yes that's right
Ms. Dominique @ [2018-09-06T20:34:55.065Z]: So 8.4 is a little more than 8 wholes..... How far away is 8 wholes from 9 wholes?
Kelijah @ [2018-09-06T20:35:32.452Z]: can you just tell me the ansewer
Ms. Dominique @ [2018-09-06T20:35:44.119Z]: I don't give out answers, but I'd be happy to help you understand the problem :)
Kelijah @ [2018-09-06T20:35:58.937Z]: noooo
Ms. Dominique @ [2018-09-06T20:36:03.770Z]: I would like to help you. Are you ready to work on this together?
Kelijah @ [2018-09-06T20:36:27.008Z]: i dont get it plese help me
Kelijah @ [2018-09-06T20:36:46.904Z]: yes im ready
Ms. Dominique @ [2018-09-06T20:36:56.737Z]: ok
Ms. Dominique @ [2018-09-06T20:37:04.676Z]: How far apart are the whole numbers 9 and 8 from each other?
Kelijah @ [2018-09-06T20:37:20.851Z]: 1
Ms. Dominique @ [2018-09-06T20:37:46.244Z]: that's right
Ms. Dominique @ [2018-09-06T20:37:58.226Z]: So is 8.4 closer or further from 9 than 8 is?
Kelijah @ [2018-09-06T20:38:27.135Z]: closer to 8
Kelijah @ [2018-09-06T20:39:07.735Z]: i have to go bye thanks for helping
Ms. Dominique @ [2018-09-06T20:39:15.729Z]: Please come back if you need more help. Have a nice day!",0,no,6,Ms. Dominique ,Kelijah ,True,10,True
7,2127,9/19/2018,Dominique Huffman,Factors ,41443,"Server Notice @ [2018-09-19T17:12:42.859Z]: This conversation will be saved.
Server Notice @ [2018-09-19T17:12:42.863Z]: Your device supports Web RTC audio
Ms. Dominique @ [2018-09-19T17:12:42.869Z]: Hi! Let's look over your problem again. Would you like me to type or talk?
Alyssa @ [2018-09-19T17:12:50.316Z]: talk
Ms. Dominique @ [2018-09-19T17:12:57.446Z]: Did you hear my voice?
Alyssa @ [2018-09-19T17:13:00.084Z]: yes
Alyssa @ [2018-09-19T17:13:37.277Z]: ther are used in mulitiplcation
Alyssa @ [2018-09-19T17:14:16.040Z]: one
Alyssa @ [2018-09-19T17:14:22.006Z]: tow
Alyssa @ [2018-09-19T17:14:37.355Z]: 1
Alyssa @ [2018-09-19T17:14:38.346Z]: 7
Alyssa @ [2018-09-19T17:14:58.804Z]: 1
Alyssa @ [2018-09-19T17:15:00.190Z]: 7
Alyssa @ [2018-09-19T17:15:16.723Z]: foure
Alyssa @ [2018-09-19T17:15:33.100Z]: 1
Alyssa @ [2018-09-19T17:15:35.195Z]: 12
Alyssa @ [2018-09-19T17:15:38.321Z]: 21
Alyssa @ [2018-09-19T17:15:55.635Z]: 21
Alyssa @ [2018-09-19T17:16:48.625Z]: talk
Ms. Dominique @ [2018-09-19T17:17:09.078Z]: We must not have a good audio connection today. Let's type!
Ms. Dominique @ [2018-09-19T17:17:17.483Z]: What other numbers can you multiply together to get 21 ?
Alyssa @ [2018-09-19T17:17:40.030Z]: 1 21
Ms. Dominique @ [2018-09-19T17:17:52.076Z]: ok what other numbers besides 1 and 21 ?
Alyssa @ [2018-09-19T17:18:03.067Z]: idk
Alyssa @ [2018-09-19T17:18:12.911Z]: i confucd
Ms. Dominique @ [2018-09-19T17:18:27.558Z]: try to think of some other multilplication facts
Alyssa @ [2018-09-19T17:19:00.961Z]: 3
Ms. Dominique @ [2018-09-19T17:19:11.941Z]: good, 3 x ☐ = 21 ?
Alyssa @ [2018-09-19T17:19:28.982Z]: 6
Ms. Dominique @ [2018-09-19T17:19:32.880Z]: not quite, try again
Ms. Dominique @ [2018-09-19T17:19:36.269Z]: 3 x ☐ = 21 ?
Alyssa @ [2018-09-19T17:19:49.366Z]: 7
Ms. Dominique @ [2018-09-19T17:19:52.921Z]: Right
Ms. Dominique @ [2018-09-19T17:19:58.990Z]: So 3 and 7 are two more factors of 21
Alyssa @ [2018-09-19T17:20:12.598Z]: yes
Ms. Dominique @ [2018-09-19T17:20:32.809Z]: Think about what we talked about when you enter your answer
Ms. Dominique @ [2018-09-19T17:20:35.594Z]: Please come back if you need more help. Have a nice day!
Alyssa @ [2018-09-19T17:21:01.261Z]: ok",0,no,6,Ms. Dominique ,Alyssa ,talk,8,True
8,4277,9/19/2018,Dominique Huffman,Solving Multiplication and Division Equations ,94067,"Server Notice @ [2018-09-19T20:09:25.284Z]: This conversation will be saved.
Ms. Dominique @ [2018-09-19T20:09:25.285Z]: Hi! Let's look over your problem again. Your device does not support chat audio. We need to type. Ready?
AUSTIN @ [2018-09-19T20:10:21.909Z]: Ok
AUSTIN @ [2018-09-19T20:11:25.364Z]: Are you still there
Ms. Dominique @ [2018-09-19T20:11:34.322Z]: Yes I'm still here. I'm sorry for the delay!
Ms. Dominique @ [2018-09-19T20:11:45.359Z]: 40 = 5 × □ What number will make that true?
AUSTIN @ [2018-09-19T20:12:48.003Z]: By multiplying
Ms. Dominique @ [2018-09-19T20:13:03.154Z]: what can we multiply by 5 to be equal to 40?
AUSTIN @ [2018-09-19T20:13:21.358Z]: 7
Ms. Dominique @ [2018-09-19T20:13:58.127Z]: well what does 5x7 equal?
AUSTIN @ [2018-09-19T20:14:23.674Z]: 35
Ms. Dominique @ [2018-09-19T20:15:20.906Z]: right so does 40 = 5x7 ?
AUSTIN @ [2018-09-19T20:17:09.501Z]: Sorry I half to switch bye bye
Ms. Dominique @ [2018-09-19T20:17:25.119Z]: Please come back if you need more help. Have a nice day!",0,no,6,Ms. Dominique ,AUSTIN ,True,5,True
9,6207,9/19/2018,Dominique Huffman,Visualizing Rounding,30286,"Server Notice @ [2018-09-19T19:06:51.259Z]: This conversation will be saved.
Server Notice @ [2018-09-19T19:06:51.262Z]: Your device supports Web RTC audio
Ms. Dominique @ [2018-09-19T19:06:51.263Z]: Hi! Let's look over your problem again. Would you like me to type or talk?
BLAKE @ [2018-09-19T19:07:16.834Z]: type
Ms. Dominique @ [2018-09-19T19:07:56.388Z]: What do you already know about rounding to the tens place?
BLAKE @ [2018-09-19T19:08:33.811Z]: 35
Ms. Dominique @ [2018-09-19T19:09:37.655Z]: What does  35 round to the nearest ten?
BLAKE @ [2018-09-19T19:09:46.637Z]: 30
Ms. Dominique @ [2018-09-19T19:10:14.482Z]: is the 5 telling us to round up or down?
BLAKE @ [2018-09-19T19:10:55.430Z]: down
Ms. Dominique @ [2018-09-19T19:11:22.281Z]: Well do you remember the rule for rounding?
BLAKE @ [2018-09-19T19:11:31.745Z]: up
Ms. Dominique @ [2018-09-19T19:11:39.652Z]: Right so What does  35 round to the nearest ten?
BLAKE @ [2018-09-19T19:11:47.964Z]: 30
Ms. Dominique @ [2018-09-19T19:12:07.455Z]: we want to round up remember?
BLAKE @ [2018-09-19T19:13:08.329Z]: I just got it right.
Ms. Dominique @ [2018-09-19T19:13:20.400Z]: Please come back if you need more help. Have a nice day!
BLAKE @ [2018-09-19T19:13:30.884Z]: by",0,no,6,Ms. Dominique ,BLAKE ,True,7,True
10,7028,9/12/2018,Dominique Huffman,Concept of Multiplication - Word Problems ,4599,"Server Notice @ [2018-09-12T20:16:57.649Z]: This conversation will be saved.
Ms. Dominique @ [2018-09-12T20:16:57.650Z]: Hi! Let's look over your problem again. Your device does not support chat audio. We need to type. Ready?
Wendy @ [2018-09-12T20:17:25.326Z]: Hi
Ms. Dominique @ [2018-09-12T20:17:35.994Z]: How many boxes of bagels are in this example?
Wendy @ [2018-09-12T20:19:07.460Z]: Three boxes
Ms. Dominique @ [2018-09-12T20:19:16.049Z]: that's right
Ms. Dominique @ [2018-09-12T20:19:21.493Z]: and how many bagels are in each box?
Wendy @ [2018-09-12T20:19:39.023Z]: 13
Ms. Dominique @ [2018-09-12T20:19:47.377Z]: is that what 'a dozen' means?
Ms. Dominique @ [2018-09-12T20:20:17.990Z]: do you know what number that is?
Wendy @ [2018-09-12T20:20:34.820Z]: Yeah
Ms. Dominique @ [2018-09-12T20:20:41.272Z]: what number is 'a dozen'?
Wendy @ [2018-09-12T20:20:52.353Z]: 12
Ms. Dominique @ [2018-09-12T20:21:03.273Z]: Right
Ms. Dominique @ [2018-09-12T20:21:09.703Z]: So how many bagels are in all 3 boxes?
Wendy @ [2018-09-12T20:21:34.123Z]: 36
Ms. Dominique @ [2018-09-12T20:21:37.224Z]: right
Ms. Dominique @ [2018-09-12T20:21:38.194Z]: Do you have any questions before you continue on your own?
Wendy @ [2018-09-12T20:22:28.049Z]: No but  thank you 😁
Ms. Dominique @ [2018-09-12T20:22:31.529Z]: You're welcome
Ms. Dominique @ [2018-09-12T20:22:32.292Z]: Please come back if you need more help. Have a nice day!",0,no,6,Ms. Dominique ,Wendy ,True,7,True
11,1620,9/18/2018,Dominique Huffman,Adding Whole Numbers ,4119,"Server Notice @ [2018-09-18T15:56:12.751Z]: This conversation will be saved.
Ms. Dominique @ [2018-09-18T15:56:12.751Z]: Hi! Let's look over your problem again. Your device does not support chat audio. We need to type. Ready?
Leighandra @ [2018-09-18T15:56:44.132Z]: hi
Ms. Dominique @ [2018-09-18T15:56:56.258Z]: According to this problem, how many miles is your family's home from the beach?
Leighandra @ [2018-09-18T15:57:42.606Z]: I am having  a problem with this  problem
Ms. Dominique @ [2018-09-18T15:57:53.608Z]: what question do you have?
Leighandra @ [2018-09-18T15:59:32.871Z]: yuor drives 219 to  the beach  the same distance back home
Ms. Dominique @ [2018-09-18T15:59:44.558Z]: Right, How many miles would you drive on one trip, there and back?
Leighandra @ [2018-09-18T16:00:13.405Z]: 438
Ms. Dominique @ [2018-09-18T16:00:19.644Z]: That's right very good
Leighandra @ [2018-09-18T16:00:20.287Z]: right
Ms. Dominique @ [2018-09-18T16:00:24.036Z]: So that's the number of miles  in one round trip to the beach then home. How many trips a year do you take?
Leighandra @ [2018-09-18T16:00:55.494Z]: I don;t  get it
Ms. Dominique @ [2018-09-18T16:01:05.749Z]: Read the problem again carefully, please ... It says ☐ times a year ?
Leighandra @ [2018-09-18T16:01:36.972Z]: so i do 438 +438
Leighandra @ [2018-09-18T16:01:40.545Z]: right
Ms. Dominique @ [2018-09-18T16:01:56.908Z]: Right!
Leighandra @ [2018-09-18T16:02:25.785Z]: so it will be 876 right
Ms. Dominique @ [2018-09-18T16:02:41.628Z]: exactly, good thinking
Ms. Dominique @ [2018-09-18T16:02:42.669Z]: Please come back if you need more help. Have a nice day!
Leighandra @ [2018-09-18T16:02:53.565Z]: bye
Leighandra @ [2018-09-18T16:03:06.352Z]: have a good day",0,no,6,Ms. Dominique ,Leighandra ,True,8,True
12,5453,9/5/2018,Dominique Huffman,Visualizing Subtraction,30244,"Server Notice @ [2018-09-05T15:30:33.586Z]: This conversation will be saved.
Server Notice @ [2018-09-05T15:30:33.587Z]: Your device supports Web RTC audio
Ms. Dominique @ [2018-09-05T15:30:33.588Z]: Hi! Let's look over your problem again. Would you like me to type or talk?
William @ [2018-09-05T15:30:58.607Z]: type
Ms. Dominique @ [2018-09-05T15:31:08.167Z]: What does this problem ask you to find?
William @ [2018-09-05T15:32:47.427Z]: i do not know the  the 9-7=
Ms. Dominique @ [2018-09-05T15:32:54.456Z]: Yes that's right!
Ms. Dominique @ [2018-09-05T15:32:59.251Z]: What does 9 - 7 equal?
William @ [2018-09-05T15:33:15.060Z]: what right?
Ms. Dominique @ [2018-09-05T15:33:33.131Z]: it's right that you have to do 9 - 7
William @ [2018-09-05T15:34:01.400Z]: 9-7=2!
Ms. Dominique @ [2018-09-05T15:34:06.225Z]: Right!
Ms. Dominique @ [2018-09-05T15:34:17.085Z]: So how many tomatoes does Fiona have left?
William @ [2018-09-05T15:34:25.667Z]: 2
Ms. Dominique @ [2018-09-05T15:34:31.241Z]: very good :)
Ms. Dominique @ [2018-09-05T15:34:32.228Z]: Please come back if you need more help. Have a nice day!
William @ [2018-09-05T15:35:28.052Z]: thank you",0,no,6,Ms. Dominique ,William ,True,5,True
13,6924,9/18/2018,Dominique Huffman,Rounding Whole Numbers ,94113,"Server Notice @ [2018-09-18T18:19:36.080Z]: This conversation will be saved.
Ms. Dominique @ [2018-09-18T18:19:36.081Z]: Hi! Let's look over your problem again. Your device does not support chat audio. We need to type. Ready?
Makhi @ [2018-09-18T18:19:43.355Z]: Yas
Ms. Dominique @ [2018-09-18T18:19:57.160Z]: What two place values does the problem say to round to?
Makhi @ [2018-09-18T18:20:40.718Z]: Um
Makhi @ [2018-09-18T18:21:01.641Z]: Neither
Ms. Dominique @ [2018-09-18T18:21:15.881Z]: Do you see what to round to the 'nearest' ...?
Makhi @ [2018-09-18T18:22:12.663Z]: Yea on all of them
Ms. Dominique @ [2018-09-18T18:22:38.225Z]: do you see where it says Thousand and Hundred?
Makhi @ [2018-09-18T18:22:49.382Z]: Yes
Ms. Dominique @ [2018-09-18T18:22:58.123Z]: Ok good. Let's take a look at an example together.
Ms. Dominique @ [2018-09-18T18:23:31.749Z]: What does 1,550  round to the nearest thousand?
Makhi @ [2018-09-18T18:23:57.885Z]: 2000
Ms. Dominique @ [2018-09-18T18:24:01.836Z]: that's right
Ms. Dominique @ [2018-09-18T18:24:15.450Z]: What does 1,550  round to the nearest hundred?
Makhi @ [2018-09-18T18:24:23.065Z]: 2000
Ms. Dominique @ [2018-09-18T18:24:39.943Z]: that's still the thousands
Makhi @ [2018-09-18T18:24:48.878Z]: It wont let me draw is it for a reason?
Ms. Dominique @ [2018-09-18T18:24:49.623Z]: now we want to round to the hundreds place
Ms. Dominique @ [2018-09-18T18:24:56.389Z]: ok try drawing now
Makhi @ [2018-09-18T18:25:09.856Z]: There we go
Makhi @ [2018-09-18T18:25:31.055Z]: Hundreds place
Ms. Dominique @ [2018-09-18T18:26:03.994Z]: I don't know what that's supposed to mean?
Makhi @ [2018-09-18T18:26:20.578Z]: 2000
Ms. Dominique @ [2018-09-18T18:26:45.429Z]: it won't be 2,000
Ms. Dominique @ [2018-09-18T18:26:52.495Z]: Underline the hundreds place in 1,550
Makhi @ [2018-09-18T18:27:35.012Z]: I did it
Ms. Dominique @ [2018-09-18T18:27:44.566Z]: Good
Ms. Dominique @ [2018-09-18T18:27:52.759Z]: Now what digit is to the right of the hundreds place?
Makhi @ [2018-09-18T18:29:06.644Z]: I did it
Ms. Dominique @ [2018-09-18T18:29:26.126Z]: good, is that 5 telling us to round up or down/
Makhi @ [2018-09-18T18:29:37.740Z]: Up
Ms. Dominique @ [2018-09-18T18:29:52.211Z]: right
Ms. Dominique @ [2018-09-18T18:30:00.150Z]: So what is 1,550 with the hundreds place rounded up?
Makhi @ [2018-09-18T18:31:19.004Z]: 1600
Makhi @ [2018-09-18T18:31:23.133Z]: Ooo
Ms. Dominique @ [2018-09-18T18:31:48.567Z]: very good
Ms. Dominique @ [2018-09-18T18:31:49.498Z]: Do you have any questions before you continue on your own?
Makhi @ [2018-09-18T18:31:59.936Z]: Yes
Makhi @ [2018-09-18T18:32:33.452Z]: Yes
Ms. Dominique @ [2018-09-18T18:33:19.410Z]: ok what's your question?
Makhi @ [2018-09-18T18:34:32.934Z]: So if im rounding to the nearest hundred or thousand do i look to the next two numbers?
Makhi @ [2018-09-18T18:35:10.393Z]: Because normally i just do t by the next number to the right
Ms. Dominique @ [2018-09-18T18:35:17.520Z]: yes so if you round to the thousands place you look at thousands and hundreds
Ms. Dominique @ [2018-09-18T18:35:23.803Z]: if you round to the hundreds place you look at hundreds and tens
Makhi @ [2018-09-18T18:35:59.294Z]: Ok thanks hope to see you again",113,no,6,Ms. Dominique ,Makhi ,True,15,True
14,1935,9/20/2018,Dominique Huffman,Introduction to Dividing Whole Numbers - Standard Algorithm,32025,"Server Notice @ [2018-09-20T15:42:57.793Z]: This conversation will be saved.
Server Notice @ [2018-09-20T15:42:57.800Z]: Your device supports Web RTC audio
Ms. Dominique @ [2018-09-20T15:42:57.831Z]: Hi! Let's look over your problem again. Would you like me to type or talk?
JIMMY @ [2018-09-20T15:43:05.689Z]: type
JIMMY @ [2018-09-20T15:43:15.598Z]: hi how was your day
Ms. Dominique @ [2018-09-20T15:43:15.914Z]: Have you ever worked with long division before?
JIMMY @ [2018-09-20T15:43:25.730Z]: no
Ms. Dominique @ [2018-09-20T15:43:55.470Z]: ok let's break it down
JIMMY @ [2018-09-20T15:44:16.587Z]: k
JIMMY @ [2018-09-20T15:44:18.982Z]: k
JIMMY @ [2018-09-20T15:44:19.278Z]: k
JIMMY @ [2018-09-20T15:44:19.608Z]: k
Ms. Dominique @ [2018-09-20T15:44:28.305Z]: This is showing 371÷4 .... First, how many times does 4 go into 37 (the first two digits)?
JIMMY @ [2018-09-20T15:44:28.985Z]: do i write
JIMMY @ [2018-09-20T15:44:34.718Z]: or no
Ms. Dominique @ [2018-09-20T15:45:11.347Z]: Ok go ahead
JIMMY @ [2018-09-20T15:45:17.488Z]: 9
Ms. Dominique @ [2018-09-20T15:45:32.502Z]: What is 4 x 9 ?
JIMMY @ [2018-09-20T15:45:41.881Z]: 36
Ms. Dominique @ [2018-09-20T15:46:35.235Z]: Very good, so we write 9 on the answer line, and subtract 36 under the 37
JIMMY @ [2018-09-20T15:47:41.352Z]: did i get it
Ms. Dominique @ [2018-09-20T15:47:50.430Z]: You got it :)
JIMMY @ [2018-09-20T15:47:57.263Z]: yes
Ms. Dominique @ [2018-09-20T15:48:02.201Z]: Now apply that same strategy to filling in the blanks in this problem
Ms. Dominique @ [2018-09-20T15:49:49.682Z]: Please come back if you need more help. Have a nice day!
JIMMY @ [2018-09-20T15:49:57.155Z]: no",227,no,6,Ms. Dominique ,JIMMY ,True,8,True
15,2678,9/11/2018,Dominique Huffman,Direct Variation,8195,"Server Notice @ [2018-09-11T17:35:10.928Z]: This conversation will be saved.
Server Notice @ [2018-09-11T17:35:10.929Z]: Your device supports Web RTC audio
Ms. Dominique @ [2018-09-11T17:35:10.930Z]: Hi! Let's look over your problem again. Would you like me to type or talk?
Jasmine @ [2018-09-11T17:35:31.661Z]: type
Ms. Dominique @ [2018-09-11T17:35:42.049Z]: What do you already know about Direct Variation?
Jasmine @ [2018-09-11T17:36:49.134Z]: a relationship between two variables whose ratiois constant
Ms. Dominique @ [2018-09-11T17:37:05.997Z]: That's great!
Ms. Dominique @ [2018-09-11T17:37:22.356Z]: So what would we have to do to find the 'ratio' of two numbers?
Jasmine @ [2018-09-11T17:37:37.327Z]: divide\
Ms. Dominique @ [2018-09-11T17:37:41.583Z]: exactly
Ms. Dominique @ [2018-09-11T17:37:55.924Z]: So if the ratio of y÷x is constant, then we know it's Direct Variation
Ms. Dominique @ [2018-09-11T17:37:57.477Z]: Do we want to find the answer choice that is true or false?
Jasmine @ [2018-09-11T17:38:24.313Z]: fals
Ms. Dominique @ [2018-09-11T17:38:29.528Z]: Good
Ms. Dominique @ [2018-09-11T17:38:43.050Z]: So which answer choice would the ratio of y÷x **not** be the same?
Jasmine @ [2018-09-11T17:39:20.915Z]: i got it
Ms. Dominique @ [2018-09-11T17:39:27.518Z]: Great work :)
Ms. Dominique @ [2018-09-11T17:39:29.103Z]: Please come back if you need more help. Have a nice day!
Jasmine @ [2018-09-11T17:39:32.574Z]: ok",0,no,6,Ms. Dominique ,Jasmine ,True,5,True
16,6648,9/12/2018,Dominique Huffman,Visualizing Multiplication and Division,30328,"Server Notice @ [2018-09-12T17:04:16.998Z]: This conversation will be saved.
Ms. Dominique @ [2018-09-12T17:04:16.999Z]: Hi! Let's look over your problem again. Your device does not support chat audio. We need to type. Ready?
Johnathan @ [2018-09-12T17:04:25.970Z]: Waz up
Ms. Dominique @ [2018-09-12T17:04:36.906Z]: Not much... Do you want help with this problem?
Johnathan @ [2018-09-12T17:04:39.447Z]: I mean nice to meet you
Johnathan @ [2018-09-12T17:04:54.078Z]: Yea
Ms. Dominique @ [2018-09-12T17:04:55.002Z]: nice to meet you too
Johnathan @ [2018-09-12T17:04:56.122Z]: Plz
Ms. Dominique @ [2018-09-12T17:05:02.773Z]: What do you already know about arrays?
Johnathan @ [2018-09-12T17:05:52.422Z]: It kind of like mulpcation and but they are in arrays
Ms. Dominique @ [2018-09-12T17:06:02.750Z]: right very good
Johnathan @ [2018-09-12T17:06:09.391Z]: 👌
Johnathan @ [2018-09-12T17:06:14.138Z]: Thx
Ms. Dominique @ [2018-09-12T17:06:18.816Z]: So let's look at that first array--- How many rows of circles are in it?
Johnathan @ [2018-09-12T17:06:20.316Z]: Your nice
Ms. Dominique @ [2018-09-12T17:06:29.630Z]: thanks :)
Ms. Dominique @ [2018-09-12T17:06:34.962Z]: let's look at that first array--- How many rows of circles are in it?
Johnathan @ [2018-09-12T17:06:48.061Z]: I all thare is 15 kk
Johnathan @ [2018-09-12T17:06:56.966Z]: 👌
Ms. Dominique @ [2018-09-12T17:07:08.155Z]: Right, and what multiplication is that solving?
Johnathan @ [2018-09-12T17:07:54.386Z]: Five times three right ms
Ms. Dominique @ [2018-09-12T17:08:16.084Z]: Yes very good
Ms. Dominique @ [2018-09-12T17:08:24.295Z]: So do you see which answer choice will show that correctly?
Johnathan @ [2018-09-12T17:08:29.891Z]: Five times three
Ms. Dominique @ [2018-09-12T17:08:53.925Z]: Right
Ms. Dominique @ [2018-09-12T17:08:54.796Z]: Do you have any questions before you continue on your own?
Johnathan @ [2018-09-12T17:09:18.463Z]: No i got it
Johnathan @ [2018-09-12T17:09:27.942Z]: Have a nice day
Ms. Dominique @ [2018-09-12T17:09:36.640Z]: Please come back if you need more help. Have a nice day!",0,no,6,Ms. Dominique ,Johnathan ,True,10,True
17,5578,9/4/2018,Dominique Huffman,Visualizing Place Value,30203,"Server Notice @ [2018-09-04T18:34:53.644Z]: This conversation will be saved.
Ms. Dominique @ [2018-09-04T18:34:53.645Z]: Hi! Let's look over your problem again. Your device does not support chat audio. We need to type. Ready?
Brooklyn @ [2018-09-04T18:35:16.574Z]: This math is hard
Ms. Dominique @ [2018-09-04T18:35:27.077Z]: that's ok, Let's take a look at an example together.
Brooklyn @ [2018-09-04T18:35:41.345Z]: Ok
Ms. Dominique @ [2018-09-04T18:35:42.933Z]: what number does 1 of those rectangles mean?
Brooklyn @ [2018-09-04T18:36:12.886Z]: I can't remember
Ms. Dominique @ [2018-09-04T18:36:35.809Z]: count how many small squares are in one rectangle in the problem",5,no,6,Ms. Dominique ,Brooklyn ,True,3,True
18,1632,9/12/2018,Dominique Huffman,Division as an Unknown-Factor Problem,4068,"Server Notice @ [2018-09-12T20:00:20.889Z]: This conversation will be saved.
Server Notice @ [2018-09-12T20:00:20.897Z]: Your device supports Web RTC audio
Ms. Dominique @ [2018-09-12T20:00:20.903Z]: Hi! Let's look over your problem again. Would you like me to type or talk?
JUSTIN @ [2018-09-12T20:00:32.398Z]: type
Ms. Dominique @ [2018-09-12T20:00:41.668Z]: What division problem is being solved?
JUSTIN @ [2018-09-12T20:00:56.309Z]: 32 divided by 4
Ms. Dominique @ [2018-09-12T20:01:00.489Z]: very good
Ms. Dominique @ [2018-09-12T20:01:06.922Z]: and what does 32÷2 equal?
Ms. Dominique @ [2018-09-12T20:01:12.910Z]: sorry I mean 32 ÷4
JUSTIN @ [2018-09-12T20:01:26.018Z]: 128
Ms. Dominique @ [2018-09-12T20:01:35.933Z]: we want to **divide** into 4 equal parts
JUSTIN @ [2018-09-12T20:01:52.327Z]: sorry 8
JUSTIN @ [2018-09-12T20:02:06.482Z]: i got it",0,no,6,Ms. Dominique ,JUSTIN ,True,3,True
19,37,9/11/2018,Dominique Huffman,Concept of Multiplication - Grouping ,459800,"Server Notice @ [2018-09-11T19:00:54.955Z]: This conversation will be saved.
Server Notice @ [2018-09-11T19:00:54.956Z]: Your device supports Web RTC audio
Ms. Dominique @ [2018-09-11T19:00:54.957Z]: Hi! Let's look over your problem again. Would you like me to type or talk?
Efren @ [2018-09-11T19:00:58.364Z]: hi
Ms. Dominique @ [2018-09-11T19:01:05.601Z]: hi
Efren @ [2018-09-11T19:01:11.958Z]: LOL
Ms. Dominique @ [2018-09-11T19:01:17.298Z]: What do you notice about the picture?
Efren @ [2018-09-11T19:01:45.392Z]: That they have stars
Ms. Dominique @ [2018-09-11T19:02:02.370Z]: that's true
Ms. Dominique @ [2018-09-11T19:02:06.143Z]: how many groups of stars are there?
Efren @ [2018-09-11T19:02:07.897Z]: Ya
Efren @ [2018-09-11T19:02:17.172Z]: 5
Ms. Dominique @ [2018-09-11T19:02:20.281Z]: look/
Ms. Dominique @ [2018-09-11T19:02:30.459Z]: Look at the picture carefully ... How many boxes have stars inside them?
Efren @ [2018-09-11T19:02:42.886Z]: 20 Total
Ms. Dominique @ [2018-09-11T19:02:56.070Z]: that's right 20 total stars
Ms. Dominique @ [2018-09-11T19:02:58.854Z]: How many boxes are there?
Efren @ [2018-09-11T19:03:06.355Z]: 4
Ms. Dominique @ [2018-09-11T19:03:28.376Z]: right very good
Ms. Dominique @ [2018-09-11T19:03:34.886Z]: and how many stars are in each box?
Efren @ [2018-09-11T19:03:40.204Z]: Yay
Efren @ [2018-09-11T19:04:41.153Z]: 5
Ms. Dominique @ [2018-09-11T19:04:47.962Z]: right
Ms. Dominique @ [2018-09-11T19:04:54.132Z]: How many correct answers are there?
Efren @ [2018-09-11T19:05:05.960Z]: 20
Ms. Dominique @ [2018-09-11T19:05:39.475Z]: no it says: 'Select the ☐ correct phrases below'
Efren @ [2018-09-11T19:06:15.046Z]: correct
Ms. Dominique @ [2018-09-11T19:06:23.896Z]: how many correct?
Efren @ [2018-09-11T19:06:35.129Z]: IDK
Ms. Dominique @ [2018-09-11T19:06:51.604Z]: do you see where it says **three** correct phrases?
Efren @ [2018-09-11T19:07:09.326Z]: three correct
Efren @ [2018-09-11T19:07:11.260Z]: YA
Ms. Dominique @ [2018-09-11T19:07:13.816Z]: right
Ms. Dominique @ [2018-09-11T19:07:23.374Z]: So you already got 2 right, do you see 1 more that is also correct?
Efren @ [2018-09-11T19:08:10.126Z]: https://lms.thinkthroughmath.com/
Efren @ [2018-09-11T19:08:52.072Z]: https://lms.thinkthroughmath.com/lesson_player/#lessons/481/activities/2566/items/34159
Efren @ [2018-09-11T19:09:05.022Z]: https://content.thinkthroughmath.com/uploads/image/image/314931/G3PL312GL4598S-dfd0d480284954dbe0d1c9976af55325-fbfa55bababca7894b576753752cac57.png
Ms. Dominique @ [2018-09-11T19:09:25.415Z]: Do you have any questions before you continue on your own?
Efren @ [2018-09-11T19:09:30.319Z]: Finish Welcome, Efren
Ms. Dominique @ [2018-09-11T19:09:43.627Z]: Please come back if you need more help. Have a nice day!",0,no,6,Ms. Dominique ,Efren ,True,13,True
20,5848,9/4/2018,Dominique Huffman,Subtracting Fractions ,94242,"Server Notice @ [2018-09-04T16:00:53.659Z]: This conversation will be saved.
Ms. Dominique @ [2018-09-04T16:00:53.660Z]: Hi! Let's look over your problem again. Your device does not support chat audio. We need to type. Ready?
Kellyn @ [2018-09-04T16:01:02.348Z]: Yes
Ms. Dominique @ [2018-09-04T16:01:09.550Z]: How do we add or subtract two fractions with different denominators?
Kellyn @ [2018-09-04T16:01:44.665Z]: We find the common denominator
Ms. Dominique @ [2018-09-04T16:02:07.122Z]: excellent
Ms. Dominique @ [2018-09-04T16:02:12.882Z]: What common denominator can you make with  6/7 and 3/4 ?
Kellyn @ [2018-09-04T16:03:37.885Z]: 28
Ms. Dominique @ [2018-09-04T16:03:47.760Z]: Right
Ms. Dominique @ [2018-09-04T16:04:22.542Z]: WHat is 6/7 with a denominator of 28?
Kellyn @ [2018-09-04T16:05:21.439Z]: 24/28
Ms. Dominique @ [2018-09-04T16:05:34.231Z]: Very good
Ms. Dominique @ [2018-09-04T16:05:44.516Z]: And what about 3/4  with a denominator of 28?
Kellyn @ [2018-09-04T16:06:23.408Z]: 21/28
Ms. Dominique @ [2018-09-04T16:06:27.424Z]: excellent
Ms. Dominique @ [2018-09-04T16:06:28.263Z]: Do you have any questions before you continue on your own?
Kellyn @ [2018-09-04T16:06:47.146Z]: No. thank you
Ms. Dominique @ [2018-09-04T16:06:55.994Z]: Please come back if you need more help. Have a nice day!",0,no,6,Ms. Dominique ,Kellyn ,True,6,True
21,281,9/11/2018,Dominique Huffman,Visualizing Rounding,30289,"Server Notice @ [2018-09-11T19:52:12.787Z]: This conversation will be saved.
Server Notice @ [2018-09-11T19:52:12.788Z]: Your device supports Web RTC audio
Ms. Dominique @ [2018-09-11T19:52:12.790Z]: Hi! Let's look over your problem again. Would you like me to type or talk?
CASSANDRA @ [2018-09-11T19:52:27.920Z]: SURE
CASSANDRA @ [2018-09-11T19:53:20.317Z]: WHATS THE FIRST QUESTION
Ms. Dominique @ [2018-09-11T19:53:30.274Z]: How far away is 67 from 70 on that number line?
CASSANDRA @ [2018-09-11T19:53:52.788Z]: 3
CASSANDRA @ [2018-09-11T19:54:17.587Z]: IS THAT CORRECT
Ms. Dominique @ [2018-09-11T19:54:24.768Z]: Yes that's right
Ms. Dominique @ [2018-09-11T19:54:29.119Z]: So is 67 closer to 60 or 70?
CASSANDRA @ [2018-09-11T19:54:48.656Z]: 70
Ms. Dominique @ [2018-09-11T19:55:55.861Z]: that's right
Ms. Dominique @ [2018-09-11T19:55:57.078Z]: Do you have any questions before you continue on your own?
CASSANDRA @ [2018-09-11T19:56:25.996Z]: YES KEEP HELPING ME PLEASE
Ms. Dominique @ [2018-09-11T19:56:58.416Z]: Read the answer choices carefully.
CASSANDRA @ [2018-09-11T19:58:08.768Z]: NO  KEEPHELPING ME
CASSANDRA @ [2018-09-11T19:58:44.253Z]: LOJJKJN
Ms. Dominique @ [2018-09-11T19:58:49.190Z]: I would like to help you. Are you ready to work on this together?
CASSANDRA @ [2018-09-11T19:59:24.579Z]: YES BUT I WANT ANOTHER TEACHER
Ms. Dominique @ [2018-09-11T19:59:50.494Z]: I am sorry that you do not want to work with me. Please come back when you are ready.",0,no,6,Ms. Dominique ,CASSANDRA ,True,6,True
22,5836,9/4/2018,Dominique Huffman,Visualizing Rounding,30290,"Server Notice @ [2018-09-04T18:55:16.236Z]: This conversation will be saved.
Server Notice @ [2018-09-04T18:55:16.238Z]: Your device supports Web RTC audio
Ms. Dominique @ [2018-09-04T18:55:16.239Z]: Hi! Let's look over your problem again. Would you like me to type or talk?
BRAELON @ [2018-09-04T18:55:27.526Z]: type
Ms. Dominique @ [2018-09-04T18:55:36.792Z]: What do you already know about rounding numbers?
BRAELON @ [2018-09-04T18:56:21.004Z]: see whats close by it
Ms. Dominique @ [2018-09-04T18:56:32.397Z]: Right, Let's take a look at an example together.
Ms. Dominique @ [2018-09-04T18:57:01.838Z]: What does 376  round to the nearest hundred?
BRAELON @ [2018-09-04T18:57:57.315Z]: 370
Ms. Dominique @ [2018-09-04T18:58:10.078Z]: You might be thinking of the *tens* place
Ms. Dominique @ [2018-09-04T18:58:18.828Z]: What two **hundreds** is 376 in between?
BRAELON @ [2018-09-04T18:58:41.808Z]: 380
Ms. Dominique @ [2018-09-04T18:58:54.885Z]: So what place value is 380 rounded to? Tens or Hundreds?
BRAELON @ [2018-09-04T18:59:35.096Z]: what
Ms. Dominique @ [2018-09-04T18:59:50.314Z]: Is 380 the **tens** place or the **hundreds** place?
BRAELON @ [2018-09-04T19:00:12.197Z]: hundreds
Ms. Dominique @ [2018-09-04T19:00:41.722Z]: Hundreds are numbers like 100, 200, 300 and so on
Ms. Dominique @ [2018-09-04T19:00:51.066Z]: Is 380 a number in the hundreds place?
BRAELON @ [2018-09-04T19:01:08.934Z]: yes
Ms. Dominique @ [2018-09-04T19:01:43.379Z]: what is the place value of the 8 in 380 ?
BRAELON @ [2018-09-04T19:02:00.860Z]: tens
Ms. Dominique @ [2018-09-04T19:02:25.087Z]: yes, so 380 is rounded to the **tens** place
Ms. Dominique @ [2018-09-04T19:02:42.151Z]: Now what is in the **hundreds** place of 376 ?
BRAELON @ [2018-09-04T19:03:14.938Z]: 400
Ms. Dominique @ [2018-09-04T19:03:31.033Z]: Yes, very good!
Ms. Dominique @ [2018-09-04T19:03:32.184Z]: Do you have any questions before you continue on your own?
BRAELON @ [2018-09-04T19:04:05.236Z]: can you show me apicture of dallas
BRAELON @ [2018-09-04T19:05:13.579Z]: you mad jeff",49,no,6,Ms. Dominique ,BRAELON ,True,9,True
23,5232,9/18/2018,Dominique Huffman,Introduction to Dividing Whole Numbers - Standard Algorithm,32023,"Server Notice @ [2018-09-18T16:41:13.860Z]: This conversation will be saved.
Server Notice @ [2018-09-18T16:41:13.860Z]: Your device supports Web RTC audio
Ms. Dominique @ [2018-09-18T16:41:13.861Z]: Hi! Let's look over your problem again. Would you like me to type or talk?
Olandis @ [2018-09-18T16:41:35.536Z]: hey
Ms. Dominique @ [2018-09-18T16:42:06.603Z]: Hi :)
Ms. Dominique @ [2018-09-18T16:42:11.672Z]: How much total money is being split in this probelm?
Olandis @ [2018-09-18T16:42:39.211Z]: 95
Ms. Dominique @ [2018-09-18T16:43:16.397Z]: Right
Ms. Dominique @ [2018-09-18T16:43:20.286Z]: And how many friends are sharing it?
Olandis @ [2018-09-18T16:43:47.582Z]: 4
Ms. Dominique @ [2018-09-18T16:43:53.706Z]: that's right
Ms. Dominique @ [2018-09-18T16:44:01.836Z]: So let's start by splitting up the tens .... how many tens arein 95 ?
Olandis @ [2018-09-18T16:44:33.132Z]: 13
Ms. Dominique @ [2018-09-18T16:44:44.100Z]: not quite, what number is in the tens digit of 95 ?
Olandis @ [2018-09-18T16:45:39.498Z]: 60
Ms. Dominique @ [2018-09-18T16:46:02.444Z]: not quite, try again
Olandis @ [2018-09-18T16:47:31.954Z]: I do not get this can you plz talk and explane more
Ms. Dominique @ [2018-09-18T16:48:19.721Z]: what is in the tens digit of 95 ? the 9 or the 5 ?
Olandis @ [2018-09-18T16:49:08.125Z]: talk plz
Ms. Dominique @ [2018-09-18T16:49:17.986Z]: Did you hear my voice?
Olandis @ [2018-09-18T16:49:27.876Z]: yes
Olandis @ [2018-09-18T16:50:25.811Z]: 60
Olandis @ [2018-09-18T16:50:49.802Z]: 5
Olandis @ [2018-09-18T16:52:01.775Z]: no 9 is in the ten",0,no,6,Ms. Dominique ,Olandis ,talk,7,True
24,6332,9/18/2018,Dominique Huffman,Addition and Subtraction Concepts ,994013,"Server Notice @ [2018-09-18T15:43:23.721Z]: This conversation will be saved.
Server Notice @ [2018-09-18T15:43:23.722Z]: Your device supports Web RTC audio
Ms. Dominique @ [2018-09-18T15:43:23.723Z]: Hi! Let's look over your problem again. Would you like me to type or talk?
richard @ [2018-09-18T15:44:17.580Z]: hi i need help
richard @ [2018-09-18T15:44:20.780Z]: '
richard @ [2018-09-18T15:44:29.463Z]: ops my bad
Ms. Dominique @ [2018-09-18T15:44:39.397Z]: What do you already know about the number of problems in this question?
richard @ [2018-09-18T15:44:49.784Z]: can we talk
richard @ [2018-09-18T15:45:01.678Z]: o never mind we are
richard @ [2018-09-18T15:45:20.203Z]: i have 17 complet
Ms. Dominique @ [2018-09-18T15:45:55.896Z]: Right
Ms. Dominique @ [2018-09-18T15:46:02.907Z]: And how many do you have left after that?
richard @ [2018-09-18T15:46:07.042Z]: right what
Ms. Dominique @ [2018-09-18T15:46:17.027Z]: How many problems do you have left to complete?
richard @ [2018-09-18T15:46:26.647Z]: 12
richard @ [2018-09-18T15:46:41.434Z]: i got to go by sorry
Ms. Dominique @ [2018-09-18T15:46:45.565Z]: Please come back if you need more help. Have a nice day!",0,no,6,Ms. Dominique ,richard ,talk,4,True
25,2028,9/11/2018,Dominique Huffman,Using Visual Models to Understand the Distributive Property,41025,"Server Notice @ [2018-09-11T18:31:47.511Z]: This conversation will be saved.
Server Notice @ [2018-09-11T18:31:47.512Z]: Your device supports Web RTC audio
Ms. Dominique @ [2018-09-11T18:31:47.513Z]: Hi! Let's look over your problem again. Would you like me to type or talk?
Andrea @ [2018-09-11T18:32:22.250Z]: talk
Ms. Dominique @ [2018-09-11T18:32:30.727Z]: Did you hear my voice?
Andrea @ [2018-09-11T18:32:39.517Z]: no
Ms. Dominique @ [2018-09-11T18:33:09.242Z]: I am sorry, we must not have a good connection today. Let's type.
Ms. Dominique @ [2018-09-11T18:33:20.983Z]: What is the length and width of the array?
Andrea @ [2018-09-11T18:36:47.767Z]: talk please it just cannt hear you can you talk louder
Ms. Dominique @ [2018-09-11T18:36:59.865Z]: Did you hear my voice?
Andrea @ [2018-09-11T18:37:22.104Z]: yes
Andrea @ [2018-09-11T18:38:50.680Z]: what
Andrea @ [2018-09-11T18:40:09.577Z]: what
Ms. Dominique @ [2018-09-11T18:40:20.976Z]: I don't think you are able to hear me, but we can type!
Ms. Dominique @ [2018-09-11T18:40:26.699Z]: What is the length and width of that array?",0,no,6,Ms. Dominique ,Andrea ,talk,4,True
26,5717,9/19/2018,Dominique Huffman,Understanding Tens and Ones ,94536,"Server Notice @ [2018-09-19T15:58:16.893Z]: This conversation will be saved.
Server Notice @ [2018-09-19T15:58:16.893Z]: Your device supports Web RTC audio
Ms. Dominique @ [2018-09-19T15:58:16.894Z]: Hi! Let's look over your problem again. Would you like me to type or talk?
JASIEL @ [2018-09-19T15:58:22.460Z]: hello
Ms. Dominique @ [2018-09-19T15:58:27.785Z]: HI
Ms. Dominique @ [2018-09-19T15:58:35.002Z]: What order will the values in the problem go in?
JASIEL @ [2018-09-19T15:58:37.700Z]: help
JASIEL @ [2018-09-19T15:58:46.691Z]: l to g
Ms. Dominique @ [2018-09-19T15:58:54.605Z]: good, so let's break down each value
JASIEL @ [2018-09-19T15:59:02.407Z]: ok
Ms. Dominique @ [2018-09-19T15:59:27.847Z]: What is the value of the 4 in 47?
JASIEL @ [2018-09-19T15:59:38.622Z]: ones?
Ms. Dominique @ [2018-09-19T15:59:56.339Z]: not quite, look at the 4 in 47
JASIEL @ [2018-09-19T16:00:15.089Z]: idk this is hard
Ms. Dominique @ [2018-09-19T16:00:41.626Z]: write the number 47 in words please
JASIEL @ [2018-09-19T16:00:55.819Z]: forty seven
Ms. Dominique @ [2018-09-19T16:01:26.733Z]: Right so 'forty' is the value of the 4 which is what number?
JASIEL @ [2018-09-19T16:02:03.507Z]: idk
JASIEL @ [2018-09-19T16:02:09.313Z]: its hard
Ms. Dominique @ [2018-09-19T16:02:12.604Z]: write 'forty' as a number
JASIEL @ [2018-09-19T16:02:17.724Z]: 40
Ms. Dominique @ [2018-09-19T16:02:23.946Z]: right!
Ms. Dominique @ [2018-09-19T16:02:29.307Z]: So the 4 in 47 has a value of 40
Ms. Dominique @ [2018-09-19T16:02:43.384Z]: Which place value of 55 is underlined? tens or ones?
JASIEL @ [2018-09-19T16:02:59.261Z]: ohhh i got u now and tens?
Ms. Dominique @ [2018-09-19T16:03:24.097Z]: look at the digit that's **underlined** in 55
JASIEL @ [2018-09-19T16:03:34.804Z]: ones?
Ms. Dominique @ [2018-09-19T16:03:39.278Z]: Good
Ms. Dominique @ [2018-09-19T16:03:45.130Z]: What is the value of 5 ones?
JASIEL @ [2018-09-19T16:04:11.788Z]: idk
Ms. Dominique @ [2018-09-19T16:04:55.261Z]: 5x1 = ?
JASIEL @ [2018-09-19T16:04:58.776Z]: 5
Ms. Dominique @ [2018-09-19T16:05:06.146Z]: Yes so 5 ones is 5
Ms. Dominique @ [2018-09-19T16:05:07.164Z]: Does that make sense?
JASIEL @ [2018-09-19T16:05:18.755Z]: not quite
Ms. Dominique @ [2018-09-19T16:05:48.200Z]: the 5 in the ones place has a value of 5 ones which is just 5
Ms. Dominique @ [2018-09-19T16:05:49.080Z]: Does that make sense?
JASIEL @ [2018-09-19T16:05:57.578Z]: yes
Ms. Dominique @ [2018-09-19T16:06:20.774Z]: Now what is the value of the 3 in 31 ?
JASIEL @ [2018-09-19T16:06:27.853Z]: tens
JASIEL @ [2018-09-19T16:06:35.334Z]: 30?
Ms. Dominique @ [2018-09-19T16:06:42.646Z]: yes very good
JASIEL @ [2018-09-19T16:06:49.310Z]: and then 6?
Ms. Dominique @ [2018-09-19T16:06:51.010Z]: What about the 6 in 16 ?
JASIEL @ [2018-09-19T16:07:02.962Z]: ^",70,no,6,Ms. Dominique ,JASIEL ,True,16,True
27,81,9/18/2018,Dominique Huffman,Visualizing Subtraction,30247,"Server Notice @ [2018-09-18T16:39:36.899Z]: This conversation will be saved.
Server Notice @ [2018-09-18T16:39:36.901Z]: Your device supports Web RTC audio
Ms. Dominique @ [2018-09-18T16:39:36.903Z]: Hi! Let's look over your problem again. Would you like me to type or talk?
REDATE @ [2018-09-18T16:40:21.944Z]: hi i need help for this question please
Ms. Dominique @ [2018-09-18T16:40:41.054Z]: ok :)
Ms. Dominique @ [2018-09-18T16:40:52.778Z]: What does the problem say about Cole and Kayla's marbles?
REDATE @ [2018-09-18T16:41:33.684Z]: i would please like to hear you
Ms. Dominique @ [2018-09-18T16:42:02.207Z]: Did you hear my voice?
REDATE @ [2018-09-18T16:42:10.179Z]: no
Ms. Dominique @ [2018-09-18T16:42:15.623Z]: I am sorry, we must not have a good connection today. Let's type.
Ms. Dominique @ [2018-09-18T16:42:20.001Z]: What does the problem say about Cole and Kayla's marbles?
REDATE @ [2018-09-18T16:43:41.713Z]: it says that cole has 3 more marbles than kayla
Ms. Dominique @ [2018-09-18T16:43:50.175Z]: Right! What does 'more than' mean?
REDATE @ [2018-09-18T16:43:58.758Z]: add
Ms. Dominique @ [2018-09-18T16:44:21.784Z]: That's right
Ms. Dominique @ [2018-09-18T16:44:34.035Z]: So let's say Kayla has 1 marble.... what number is '3 more than 1 '?
REDATE @ [2018-09-18T16:44:41.819Z]: 4
Ms. Dominique @ [2018-09-18T16:45:02.584Z]: Right!
Ms. Dominique @ [2018-09-18T16:45:10.500Z]: So if Kayla has 1 marble, how many does Cole have?
REDATE @ [2018-09-18T16:45:44.684Z]: 3
Ms. Dominique @ [2018-09-18T16:45:57.075Z]: well remember what number is 3 **more** than
Ms. Dominique @ [2018-09-18T16:45:58.277Z]: 1
REDATE @ [2018-09-18T16:46:11.704Z]: oh
Ms. Dominique @ [2018-09-18T16:47:18.966Z]: Do you have any questions before you continue on your own?
REDATE @ [2018-09-18T16:49:19.087Z]: yes um how do i now howmuch kayla has
Ms. Dominique @ [2018-09-18T16:49:51.536Z]: you can just choose a random number for Kayla and add 3 to get Cole
REDATE @ [2018-09-18T16:50:15.609Z]: oh bye thank you
Ms. Dominique @ [2018-09-18T16:50:35.973Z]: Please come back if you need more help. Have a nice day!",0,no,6,Ms. Dominique ,REDATE ,True,10,True
28,2859,9/19/2018,Dominique Huffman,Exploring Unit Rates on Graphs ,32745,"Server Notice @ [2018-09-19T20:38:07.428Z]: This conversation will be saved.
Server Notice @ [2018-09-19T20:38:07.430Z]: Your device supports Web RTC audio
Ms. Dominique @ [2018-09-19T20:38:07.430Z]: Hi! Let's look over your problem again. Would you like me to type or talk?
DAYTON @ [2018-09-19T20:38:24.294Z]: type
Ms. Dominique @ [2018-09-19T20:38:38.834Z]: What point is shown on the graph?
DAYTON @ [2018-09-19T20:38:44.764Z]: I have a question just one then we can get onto the problem
DAYTON @ [2018-09-19T20:39:02.729Z]: Do you like cookies?
DAYTON @ [2018-09-19T20:39:15.243Z]: O.K now lets get onto the problem
Ms. Dominique @ [2018-09-19T20:39:44.626Z]: Yes I like cookies
Ms. Dominique @ [2018-09-19T20:39:49.011Z]: What point is shown on the graph?
DAYTON @ [2018-09-19T20:40:01.335Z]: (1.5,30)
Ms. Dominique @ [2018-09-19T20:40:07.482Z]: that's right
Ms. Dominique @ [2018-09-19T20:40:13.332Z]: What does 1.5 represent in that point?
DAYTON @ [2018-09-19T20:40:29.777Z]: does it mean hours
Ms. Dominique @ [2018-09-19T20:41:14.659Z]: that's right
Ms. Dominique @ [2018-09-19T20:41:17.427Z]: and what does 30 represent?
DAYTON @ [2018-09-19T20:41:29.108Z]: distance (Miles)
Ms. Dominique @ [2018-09-19T20:41:33.298Z]: Very good
Ms. Dominique @ [2018-09-19T20:41:49.413Z]: So if she biked 30 miles in 1.5 hours, how do we find the rate in 'miles per hour' ?
DAYTON @ [2018-09-19T20:42:39.737Z]: divide or i dont know
Ms. Dominique @ [2018-09-19T20:43:03.118Z]: yes that's right
Ms. Dominique @ [2018-09-19T20:43:05.560Z]: What division problem is being solved?
DAYTON @ [2018-09-19T20:44:34.175Z]: I think your dividing with the numbers on the graph shown above.
Ms. Dominique @ [2018-09-19T20:44:57.510Z]: ok, so please tell me what numbers you'll divide to find 'miles per hour' ?",0,no,6,Ms. Dominique ,DAYTON ,True,7,True
29,5125,9/12/2018,Dominique Huffman,Visualizing Place Value Relationships,30269,"Server Notice @ [2018-09-12T19:44:38.698Z]: This conversation will be saved.
Server Notice @ [2018-09-12T19:44:38.699Z]: Your device supports Web RTC audio
Ms. Dominique @ [2018-09-12T19:44:38.700Z]: Hi! Let's look over your problem again. Would you like me to type or talk?
Alayna @ [2018-09-12T19:44:56.472Z]: type please
Ms. Dominique @ [2018-09-12T19:45:50.983Z]: What two numbers are we comparing in this problem?
Alayna @ [2018-09-12T19:46:15.947Z]: 3 tens and 3 ones
Ms. Dominique @ [2018-09-12T19:46:46.451Z]: that's right
Ms. Dominique @ [2018-09-12T19:46:50.714Z]: What number does 3 tens equal?
Alayna @ [2018-09-12T19:47:21.053Z]: im not sure
Ms. Dominique @ [2018-09-12T19:47:50.323Z]: well what is 3 x 10?
Alayna @ [2018-09-12T19:48:07.271Z]: 30
Ms. Dominique @ [2018-09-12T19:48:32.008Z]: Right so 3 tens is 30
Alayna @ [2018-09-12T19:48:59.988Z]: yes
Ms. Dominique @ [2018-09-12T19:49:13.743Z]: and what number is 3 ones?
Alayna @ [2018-09-12T19:49:27.368Z]: 3
Ms. Dominique @ [2018-09-12T19:49:36.902Z]: Right
Ms. Dominique @ [2018-09-12T19:49:40.837Z]: So how many groups of 3 go into 30?
Alayna @ [2018-09-12T19:49:58.400Z]: 3
Ms. Dominique @ [2018-09-12T19:50:19.910Z]: not quite, think of it this way
Ms. Dominique @ [2018-09-12T19:50:22.782Z]: 3 x ☐ = 30
Alayna @ [2018-09-12T19:50:48.921Z]: 3x10=30
Ms. Dominique @ [2018-09-12T19:51:04.602Z]: that's' right
Ms. Dominique @ [2018-09-12T19:51:09.352Z]: So how many groups of 3 go into 30?
Alayna @ [2018-09-12T19:51:25.305Z]: 3
Ms. Dominique @ [2018-09-12T19:51:40.185Z]: no remember what you said before
Alayna @ [2018-09-12T19:51:54.375Z]: 30?
Ms. Dominique @ [2018-09-12T19:52:25.711Z]: 3 x ☐ = 30
Alayna @ [2018-09-12T19:52:42.611Z]: 3x10=30
Alayna @ [2018-09-12T19:53:08.455Z]: is it 10?
Ms. Dominique @ [2018-09-12T19:53:10.306Z]: That's right!
Alayna @ [2018-09-12T19:53:29.400Z]: i understand
Ms. Dominique @ [2018-09-12T19:53:40.565Z]: Please come back if you need more help. Have a nice day!
Alayna @ [2018-09-12T19:53:58.513Z]: thanks",0,no,6,Ms. Dominique ,Alayna ,True,12,True
30,2061,9/12/2018,Dominique Huffman,Visualizing Place Value Relationships,30267,"Server Notice @ [2018-09-12T18:44:20.690Z]: This conversation will be saved.
Server Notice @ [2018-09-12T18:44:20.691Z]: Your device supports Web RTC audio
Ms. Dominique @ [2018-09-12T18:44:20.692Z]: Hi! Let's look over your problem again. Would you like me to type or talk?
Myah @ [2018-09-12T18:44:27.163Z]: type
Ms. Dominique @ [2018-09-12T18:44:34.113Z]: Let's take a look at an example together.
Myah @ [2018-09-12T18:44:52.668Z]: it is hard
Ms. Dominique @ [2018-09-12T18:45:06.343Z]: What number model did I draw?
Myah @ [2018-09-12T18:45:21.918Z]: 35
Ms. Dominique @ [2018-09-12T18:45:47.820Z]: that's right
Ms. Dominique @ [2018-09-12T18:46:00.312Z]: What is the place value of the 3 in 35 ?
Myah @ [2018-09-12T18:46:14.532Z]: tens
Ms. Dominique @ [2018-09-12T18:46:19.236Z]: Right
Ms. Dominique @ [2018-09-12T18:46:30.396Z]: what is the place value of the 5 in 35 ?
Myah @ [2018-09-12T18:46:42.063Z]: ones
Ms. Dominique @ [2018-09-12T18:47:08.726Z]: that's right
Ms. Dominique @ [2018-09-12T18:47:21.694Z]: Then what *number* does 3 tens equal?
Myah @ [2018-09-12T18:47:41.312Z]: 2
Ms. Dominique @ [2018-09-12T18:48:29.705Z]: not quite try again
Myah @ [2018-09-12T18:48:33.084Z]: 30
Ms. Dominique @ [2018-09-12T18:48:36.632Z]: Right 30
Ms. Dominique @ [2018-09-12T18:48:47.263Z]: And what number does 5 ones equal?
Myah @ [2018-09-12T18:49:18.137Z]: 50 think
Ms. Dominique @ [2018-09-12T18:49:41.283Z]: well is 50 equal to 5 **ones** ?
Myah @ [2018-09-12T18:50:12.498Z]: im confused
Ms. Dominique @ [2018-09-12T18:50:27.495Z]: what is 5 x 1 ?
Myah @ [2018-09-12T18:50:35.766Z]: 5
Myah @ [2018-09-12T18:50:38.203Z]: 000
Myah @ [2018-09-12T18:50:41.082Z]: ooooo
Ms. Dominique @ [2018-09-12T18:51:01.345Z]: So that's three different ways to represent my number model
Ms. Dominique @ [2018-09-12T18:51:02.864Z]: Do you have any questions before you continue on your own?
Myah @ [2018-09-12T18:51:43.115Z]: um i think
Myah @ [2018-09-12T18:52:05.325Z]: no
Myah @ [2018-09-12T18:52:08.204Z]: by
Ms. Dominique @ [2018-09-12T18:52:20.924Z]: Please come back if you need more help. Have a nice day!
Myah @ [2018-09-12T18:52:33.531Z]: you to",42,no,6,Ms. Dominique ,Myah ,True,11,True
31,6916,9/12/2018,Dominique Huffman,Reducing Fractions,4228,"Server Notice @ [2018-09-12T16:31:46.912Z]: This conversation will be saved.
Server Notice @ [2018-09-12T16:31:46.913Z]: Your device supports Web RTC audio
Ms. Dominique @ [2018-09-12T16:31:46.914Z]: Hi! Let's look over your problem again. Would you like me to type or talk?
Trent @ [2018-09-12T16:31:52.444Z]: Hey Again
Ms. Dominique @ [2018-09-12T16:31:58.599Z]: hi, Do you want help with this problem?
Trent @ [2018-09-12T16:32:05.866Z]: Yes Please
Ms. Dominique @ [2018-09-12T16:32:11.475Z]: What do you notice about the shaded sections of those two number lines?
Trent @ [2018-09-12T16:32:34.960Z]: Ones all the way to 5/7 ones to 10/14
Trent @ [2018-09-12T16:32:53.904Z]: Right
Ms. Dominique @ [2018-09-12T16:32:57.151Z]: That's right
Ms. Dominique @ [2018-09-12T16:33:04.964Z]: Do they have different amounts shaded or the same?
Trent @ [2018-09-12T16:33:24.494Z]: The same
Ms. Dominique @ [2018-09-12T16:33:34.401Z]: That's right
Ms. Dominique @ [2018-09-12T16:33:41.002Z]: So what must be true about those two fractions?
Trent @ [2018-09-12T16:33:56.451Z]: They Are Equal
Ms. Dominique @ [2018-09-12T16:34:02.582Z]: Exactly
Ms. Dominique @ [2018-09-12T16:34:03.424Z]: Do you have any questions before you continue on your own?
Trent @ [2018-09-12T16:34:31.219Z]: No Thank you have a nice day
Ms. Dominique @ [2018-09-12T16:34:36.080Z]: Please come back if you need more help. Have a nice day!
Trent @ [2018-09-12T16:34:43.813Z]: your a good teacher
Trent @ [2018-09-12T16:34:50.031Z]: Bye",0,no,6,Ms. Dominique ,Trent ,True,6,True
32,2782,9/4/2018,Dominique Huffman,Factors ,41442,"Server Notice @ [2018-09-04T20:03:17.105Z]: This conversation will be saved.
Ms. Dominique @ [2018-09-04T20:03:17.107Z]: Hi! Let's look over your problem again. Your device does not support chat audio. We need to type. Ready?
Jayden @ [2018-09-04T20:03:38.088Z]: yes
Ms. Dominique @ [2018-09-04T20:04:04.910Z]: What do you already know about Factors?
Jayden @ [2018-09-04T20:05:02.063Z]: 2
Ms. Dominique @ [2018-09-04T20:05:13.160Z]: Is 2 a factor of 30?
Jayden @ [2018-09-04T20:05:21.948Z]: yes
Ms. Dominique @ [2018-09-04T20:05:34.732Z]: What other factor goes along with 2 to make 30?
Jayden @ [2018-09-04T20:05:42.262Z]: 15
Ms. Dominique @ [2018-09-04T20:06:31.719Z]: that's right!
Ms. Dominique @ [2018-09-04T20:06:41.798Z]: Do you see what other numbers can go together int his chart?
Jayden @ [2018-09-04T20:07:11.614Z]: i got it right
Jayden @ [2018-09-04T20:07:14.257Z]: by
Ms. Dominique @ [2018-09-04T20:07:18.488Z]: Please come back if you need more help. Have a nice day!
Jayden @ [2018-09-04T20:07:26.250Z]: you to",0,no,6,Ms. Dominique ,Jayden ,True,5,True
33,4744,9/6/2018,Dominique Huffman,Solving Multiplication and Division Equations ,94067,"Server Notice @ [2018-09-06T15:18:26.740Z]: This conversation will be saved.
Server Notice @ [2018-09-06T15:18:26.742Z]: Your device supports Web RTC audio
Ms. Dominique @ [2018-09-06T15:18:26.747Z]: Hi! Let's look over your problem again. Would you like me to type or talk?
Haiden @ [2018-09-06T15:18:38.407Z]: type
Ms. Dominique @ [2018-09-06T15:18:45.068Z]: Let's take a look at an example together.
Haiden @ [2018-09-06T15:18:52.959Z]: ok
Haiden @ [2018-09-06T15:19:15.201Z]: hello
Ms. Dominique @ [2018-09-06T15:19:16.310Z]: 40 = 5 x  ☐
Ms. Dominique @ [2018-09-06T15:19:21.805Z]: what number makes that true?
Haiden @ [2018-09-06T15:19:51.230Z]: 8
Ms. Dominique @ [2018-09-06T15:20:06.174Z]: That's right
Ms. Dominique @ [2018-09-06T15:20:17.650Z]: So what box will 40 = 5 × □ go into?
Haiden @ [2018-09-06T15:20:38.560Z]: mam
Ms. Dominique @ [2018-09-06T15:20:45.625Z]: Do you think you have it from here?
Haiden @ [2018-09-06T15:20:57.488Z]: no mam
Ms. Dominique @ [2018-09-06T15:21:26.677Z]: Well you said 8 is the missing number .... so will 40 = 5 × □ go into the box that says '7, 8 or Other' ?
Haiden @ [2018-09-06T15:21:42.184Z]: yes mam
Ms. Dominique @ [2018-09-06T15:22:03.913Z]: What box will it go into?
Haiden @ [2018-09-06T15:22:31.406Z]: by and thank you
Ms. Dominique @ [2018-09-06T15:22:40.290Z]: Please come back if you need more help. Have a nice day!
Haiden @ [2018-09-06T15:23:05.391Z]: have a nice day
Haiden @ [2018-09-06T15:23:42.979Z]: hello",0,no,6,Ms. Dominique ,Haiden ,True,7,True
34,6278,9/19/2018,Dominique Huffman,Visualizing Rounding,30289,"Server Notice @ [2018-09-19T15:21:41.854Z]: This conversation will be saved.
Server Notice @ [2018-09-19T15:21:41.867Z]: Your device supports Web RTC audio
Ms. Dominique @ [2018-09-19T15:21:41.938Z]: Hi! Let's look over your problem again. Would you like me to type or talk?
Jaylee @ [2018-09-19T15:21:49.884Z]: talk
Ms. Dominique @ [2018-09-19T15:22:12.918Z]: Did you hear my voice?
Jaylee @ [2018-09-19T15:22:20.075Z]: yes
Jaylee @ [2018-09-19T15:22:45.869Z]: 67
Jaylee @ [2018-09-19T15:23:06.850Z]: hello
Jaylee @ [2018-09-19T15:23:46.885Z]: nonsense
Ms. Dominique @ [2018-09-19T15:24:05.645Z]: What do you already know about rounding to the tens place?
Jaylee @ [2018-09-19T15:24:38.756Z]: still nonsense
Jaylee @ [2018-09-19T15:25:00.875Z]: talk
Jaylee @ [2018-09-19T15:25:24.133Z]: 60 and 70
Jaylee @ [2018-09-19T15:26:12.591Z]: 7
Jaylee @ [2018-09-19T15:26:32.250Z]: away
Jaylee @ [2018-09-19T15:26:46.656Z]: repeat
Jaylee @ [2018-09-19T15:27:02.944Z]: talk
Jaylee @ [2018-09-19T15:27:24.808Z]: 3 away
Jaylee @ [2018-09-19T15:27:41.930Z]: talk
Jaylee @ [2018-09-19T15:27:54.957Z]: 70
Jaylee @ [2018-09-19T15:28:05.843Z]: talk
Ms. Dominique @ [2018-09-19T15:28:13.544Z]: Please come back if you need more help. Have a nice day!",0,no,6,Ms. Dominique ,Jaylee ,talk,3,True
35,2616,9/19/2018,Dominique Huffman,Adding Whole Numbers ,4119,"Server Notice @ [2018-09-19T19:25:56.532Z]: This conversation will be saved.
Server Notice @ [2018-09-19T19:25:56.533Z]: Your device supports Web RTC audio
Ms. Dominique @ [2018-09-19T19:25:56.533Z]: Hi! Let's look over your problem again. Would you like me to type or talk?
MYKOL @ [2018-09-19T19:26:06.831Z]: ok
Ms. Dominique @ [2018-09-19T19:26:21.888Z]: According to this problem, how many miles is your family's home from the beach?
MYKOL @ [2018-09-19T19:27:10.349Z]: if you drive to the beach do you add
Ms. Dominique @ [2018-09-19T19:29:02.567Z]: Well what do you think you would add?
MYKOL @ [2018-09-19T19:29:26.295Z]: 219 +219=438 is that right
Ms. Dominique @ [2018-09-19T19:30:25.281Z]: yes, so would that be how many miles you drive in 1 trip or 2 trips?
MYKOL @ [2018-09-19T19:31:04.437Z]: so you add again
MYKOL @ [2018-09-19T19:31:56.302Z]: thank you
Ms. Dominique @ [2018-09-19T19:32:02.355Z]: You're welcome
Ms. Dominique @ [2018-09-19T19:32:03.541Z]: Do you have any questions before you continue on your own?
MYKOL @ [2018-09-19T19:32:22.947Z]: no thank you
Ms. Dominique @ [2018-09-19T19:32:36.189Z]: Please come back if you need more help. Have a nice day!",0,no,6,Ms. Dominique ,MYKOL ,True,5,True
36,4958,9/11/2018,Dominique Huffman,Visualizing Place Value Relationships,3026600,"Server Notice @ [2018-09-11T19:29:54.285Z]: This conversation will be saved.
Server Notice @ [2018-09-11T19:29:54.286Z]: Your device supports Web RTC audio
Ms. Dominique @ [2018-09-11T19:29:54.287Z]: Hi! Let's look over your problem again. Would you like me to type or talk?
Aliyah @ [2018-09-11T19:31:32.544Z]: type and may i ask you look pretty
Ms. Dominique @ [2018-09-11T19:31:49.604Z]: thank you, but let's focus on math
Aliyah @ [2018-09-11T19:32:19.169Z]: thank you
Ms. Dominique @ [2018-09-11T19:32:24.606Z]: What number did I just model?
Aliyah @ [2018-09-11T19:32:45.898Z]: 35
Ms. Dominique @ [2018-09-11T19:33:14.572Z]: very good
Ms. Dominique @ [2018-09-11T19:33:18.998Z]: What is the place value of the 3 in 35 ?
Aliyah @ [2018-09-11T19:34:45.938Z]: the 3 is the tens place and the 5 is the ones places
Ms. Dominique @ [2018-09-11T19:35:13.520Z]: Right!
Ms. Dominique @ [2018-09-11T19:35:28.219Z]: what *value* is 3 tens?
Aliyah @ [2018-09-11T19:35:48.133Z]: thank you am i good
Ms. Dominique @ [2018-09-11T19:36:18.340Z]: Please come back if you need more help. Have a nice day!
Aliyah @ [2018-09-11T19:36:35.747Z]: the 30s place
Aliyah @ [2018-09-11T19:37:50.564Z]: please",47,no,6,Ms. Dominique ,Aliyah ,True,5,True
37,2360,9/4/2018,Dominique Huffman,Factors ,4223,"Server Notice @ [2018-09-04T17:06:47.752Z]: This conversation will be saved.
Server Notice @ [2018-09-04T17:06:47.753Z]: Your device supports Web RTC audio
Ms. Dominique @ [2018-09-04T17:06:47.754Z]: Hi! Let's look over your problem again. Would you like me to type or talk?
Olalde @ [2018-09-04T17:07:04.448Z]: hi hi hi hi
Ms. Dominique @ [2018-09-04T17:07:08.744Z]: Hi
Olalde @ [2018-09-04T17:07:11.533Z]: talk
Ms. Dominique @ [2018-09-04T17:07:14.322Z]: What answer did Leo get to his multiplication problem?
Olalde @ [2018-09-04T17:08:45.562Z]: can we use a wite board to help us  with math problome
Ms. Dominique @ [2018-09-04T17:09:10.594Z]: Sure, but let's talk about the problem first :)
Olalde @ [2018-09-04T17:09:16.662Z]: ok
Ms. Dominique @ [2018-09-04T17:09:18.071Z]: What answer did he get to his multiplication problem ?
Olalde @ [2018-09-04T17:09:46.129Z]: factors
Ms. Dominique @ [2018-09-04T17:10:03.019Z]: What do you already know about factors?
Olalde @ [2018-09-04T17:11:41.200Z]: factors are ,a hola number thats multipid
Olalde @ [2018-09-04T17:11:59.117Z]: right
Ms. Dominique @ [2018-09-04T17:12:00.341Z]: Excellent
Ms. Dominique @ [2018-09-04T17:12:07.613Z]: So what whole numbers can multiply together to get 17?
Olalde @ [2018-09-04T17:12:13.538Z]: thank you
Ms. Dominique @ [2018-09-04T17:12:24.063Z]: You're welcome
Ms. Dominique @ [2018-09-04T17:12:25.353Z]: Do you have any questions before you continue on your own?
Olalde @ [2018-09-04T17:12:47.926Z]: yes
Ms. Dominique @ [2018-09-04T17:13:00.064Z]: ok what's your question?
Olalde @ [2018-09-04T17:13:29.849Z]: what is the seveten about
Ms. Dominique @ [2018-09-04T17:13:43.425Z]: Do you see the number 17 at the bottom of Leo's multipication problem in the picture?
Olalde @ [2018-09-04T17:13:54.656Z]: ok
Ms. Dominique @ [2018-09-04T17:14:09.544Z]: Please come back if you need more help. Have a nice day!",0,no,6,Ms. Dominique ,Olalde ,talk,10,True
38,1713,9/19/2018,Dominique Huffman,Dividing Whole Numbers - One-Digit Divisors,4121,"Server Notice @ [2018-09-19T16:17:12.102Z]: This conversation will be saved.
Server Notice @ [2018-09-19T16:17:12.103Z]: Your device supports Web RTC audio
Ms. Dominique @ [2018-09-19T16:17:12.104Z]: Hi! Let's look over your problem again. Would you like me to type or talk?
Vanessa @ [2018-09-19T16:17:17.250Z]: hi
Ms. Dominique @ [2018-09-19T16:17:56.777Z]: What does remainder mean?
Vanessa @ [2018-09-19T16:18:16.557Z]: the number left over
Vanessa @ [2018-09-19T16:18:33.859Z]: ounce u divide them equaly
Ms. Dominique @ [2018-09-19T16:18:52.553Z]: YEs that's right
Ms. Dominique @ [2018-09-19T16:19:00.948Z]: Can the remainder ever be greater than the number we're dividing by?
Vanessa @ [2018-09-19T16:19:15.246Z]: no
Ms. Dominique @ [2018-09-19T16:19:30.699Z]: That's right
Ms. Dominique @ [2018-09-19T16:19:42.712Z]: So if we divide by 3 , for example, what is the biggest remainder we can possibly have?
Vanessa @ [2018-09-19T16:20:10.554Z]: 2 or 1?
Ms. Dominique @ [2018-09-19T16:20:55.852Z]: yes very good!
Ms. Dominique @ [2018-09-19T16:21:07.384Z]: So which division would it be possible to have a remainder greater than 7?
Vanessa @ [2018-09-19T16:21:44.456Z]: it would be to big?i think
Ms. Dominique @ [2018-09-19T16:22:31.102Z]: Well what is the biggest number this problem shows dividing by?
Vanessa @ [2018-09-19T16:22:41.239Z]: i thought that the remainder could only be 4 or higher
Vanessa @ [2018-09-19T16:22:48.403Z]: 9
Ms. Dominique @ [2018-09-19T16:23:02.275Z]: So what possible remainders can you have when dividing by 9?
Vanessa @ [2018-09-19T16:23:39.372Z]: you would have 1 or 3?
Ms. Dominique @ [2018-09-19T16:24:21.598Z]: Let's take a look at an example together.
Vanessa @ [2018-09-19T16:24:31.897Z]: ok
Ms. Dominique @ [2018-09-19T16:24:51.560Z]: What is 35÷9
Vanessa @ [2018-09-19T16:25:51.179Z]: 4
Ms. Dominique @ [2018-09-19T16:26:16.113Z]: well does 9 go into 35 four whole times?
Vanessa @ [2018-09-19T16:26:39.990Z]: yes
Ms. Dominique @ [2018-09-19T16:26:47.669Z]: what does 9x4 equal?
Vanessa @ [2018-09-19T16:27:00.992Z]: 36
Ms. Dominique @ [2018-09-19T16:27:25.522Z]: so that's too big
Ms. Dominique @ [2018-09-19T16:27:33.477Z]: What is 9x3 ?
Vanessa @ [2018-09-19T16:27:46.545Z]: 27
Ms. Dominique @ [2018-09-19T16:28:01.453Z]: that's right
Ms. Dominique @ [2018-09-19T16:28:07.393Z]: How much more do you add to get from 27 up to 35 ?
Vanessa @ [2018-09-19T16:28:29.538Z]: 8
Ms. Dominique @ [2018-09-19T16:28:51.646Z]: that's right!
Ms. Dominique @ [2018-09-19T16:28:57.748Z]: 35 ÷ 9 = 3 R8
Ms. Dominique @ [2018-09-19T16:28:58.510Z]: Does that make sense?
Vanessa @ [2018-09-19T16:29:12.703Z]: yes kinda
Ms. Dominique @ [2018-09-19T16:29:49.833Z]: Because 9 goes into 35 three times with 8 left over
Vanessa @ [2018-09-19T16:30:02.488Z]: ooo.....
Vanessa @ [2018-09-19T16:30:22.425Z]: i get it
Vanessa @ [2018-09-19T16:31:32.063Z]: thank u
Ms. Dominique @ [2018-09-19T16:31:33.930Z]: Please come back if you need more help. Have a nice day!
Vanessa @ [2018-09-19T16:31:56.431Z]: ok",0,no,6,Ms. Dominique ,Vanessa ,True,15,True
39,3725,9/5/2018,Dominique Huffman,Grouping Tens and Ones ,94535,"Server Notice @ [2018-09-05T19:17:59.440Z]: This conversation will be saved.
Ms. Dominique @ [2018-09-05T19:17:59.443Z]: Hi! Let's look over your problem again. Your device does not support chat audio. We need to type. Ready?
AARON @ [2018-09-05T19:18:27.752Z]: yes
Ms. Dominique @ [2018-09-05T19:18:40.187Z]: How many pencils come in each box?
AARON @ [2018-09-05T19:19:22.055Z]: 60
Ms. Dominique @ [2018-09-05T19:19:36.001Z]: Well what does the problem say about 60 pencils?
AARON @ [2018-09-05T19:20:11.448Z]: it comes with boxes of 10
Ms. Dominique @ [2018-09-05T19:20:19.111Z]: that's right
Ms. Dominique @ [2018-09-05T19:20:33.028Z]: So how many boxes of 10 are equal to 60 total pencils?
AARON @ [2018-09-05T19:21:46.859Z]: 6   40   and 4
Ms. Dominique @ [2018-09-05T19:22:16.696Z]: Right :)
Ms. Dominique @ [2018-09-05T19:22:16.782Z]: Please come back if you need more help. Have a nice day!",0,no,6,Ms. Dominique ,AARON ,True,4,True
40,5128,9/12/2018,Dominique Huffman,Structuring Within 100,41190,"Server Notice @ [2018-09-12T18:41:12.140Z]: This conversation will be saved.
Server Notice @ [2018-09-12T18:41:12.141Z]: Your device supports Web RTC audio
Ms. Dominique @ [2018-09-12T18:41:12.143Z]: Hi! Let's look over your problem again. Would you like me to type or talk?
Eden @ [2018-09-12T18:41:24.914Z]: type
Ms. Dominique @ [2018-09-12T18:41:57.672Z]: What addition problem is being solved here?
Eden @ [2018-09-12T18:42:01.379Z]: are you real?
Ms. Dominique @ [2018-09-12T18:42:36.659Z]: Yes I'm a real person :)
Ms. Dominique @ [2018-09-12T18:42:37.878Z]: What addition problem is being solved here?
Eden @ [2018-09-12T18:43:27.902Z]: number problums
Ms. Dominique @ [2018-09-12T18:43:44.030Z]: Do you see what's being added to 36 in this probleM?
Eden @ [2018-09-12T18:44:47.036Z]: no caus i cant go down
Ms. Dominique @ [2018-09-12T18:45:16.074Z]: scroll down to view the rest of the problem
Eden @ [2018-09-12T18:45:34.788Z]: i cant
Ms. Dominique @ [2018-09-12T18:45:44.629Z]: please try
Eden @ [2018-09-12T18:46:21.014Z]: i did and i cant
Ms. Dominique @ [2018-09-12T18:46:49.049Z]: you'll might have to exit and come back so that you can see the problm
Eden @ [2018-09-12T18:47:01.277Z]: ok
Ms. Dominique @ [2018-09-12T18:47:24.918Z]: Please come back if you need more help. Have a nice day!
Eden @ [2018-09-12T18:47:36.565Z]: ok",0,no,6,Ms. Dominique ,Eden ,True,7,True
41,995,8/23/2018,Dominique Huffman,Operations with Whole Numbers - Mixed Practice ,94590,"Server Notice @ [2018-08-23T18:33:02.758Z]: This conversation will be saved.
Server Notice @ [2018-08-23T18:33:02.759Z]: Your device supports Web RTC audio
Ms. Dominique @ [2018-08-23T18:33:02.759Z]: Hi! Let's look over your problem again. Would you like me to type or talk?
Fabian @ [2018-08-23T18:33:09.094Z]: ok
Ms. Dominique @ [2018-08-23T18:33:13.267Z]: Let's take a look at an example together.
Fabian @ [2018-08-23T18:33:18.777Z]: ok
Ms. Dominique @ [2018-08-23T18:33:22.821Z]: If you have $15 split among 3 friends, how many dollars will each friend get?
Fabian @ [2018-08-23T18:33:39.126Z]: 5 dollers
Ms. Dominique @ [2018-08-23T18:33:47.970Z]: Right!
Ms. Dominique @ [2018-08-23T18:33:48.534Z]: How did you get that answer?
Fabian @ [2018-08-23T18:34:05.474Z]: by dividing my answer
Fabian @ [2018-08-23T18:34:28.019Z]: hello
Ms. Dominique @ [2018-08-23T18:34:48.629Z]: Very good",0,no,6,Ms. Dominique ,Fabian ,True,4,True
42,6605,9/6/2018,Dominique Huffman,Multiplying 3-digit by 2-digit Whole Numbers Using the Standard Algorithm,33072,"Server Notice @ [2018-09-06T15:12:03.317Z]: This conversation will be saved.
Server Notice @ [2018-09-06T15:12:03.318Z]: Your device supports Web RTC audio
Ms. Dominique @ [2018-09-06T15:12:03.318Z]: Hi! Let's look over your problem again. Would you like me to type or talk?
Ivette @ [2018-09-06T15:12:17.063Z]: type please
Ms. Dominique @ [2018-09-06T15:12:31.372Z]: Have you ever multiplied two digit numbers before?
Ivette @ [2018-09-06T15:12:45.073Z]: yes
Ms. Dominique @ [2018-09-06T15:13:00.115Z]: Great :)
Ivette @ [2018-09-06T15:13:06.359Z]: yay XD
Ms. Dominique @ [2018-09-06T15:13:16.983Z]: So can you try multiplying 216*45 please
Ms. Dominique @ [2018-09-06T15:15:40.885Z]: Doing good so far!",95,no,6,Ms. Dominique ,Ivette ,True,3,True
43,160,9/12/2018,Dominique Huffman,Visualizing Place Value Relationships,30269,"Server Notice @ [2018-09-12T18:48:54.983Z]: This conversation will be saved.
Ms. Dominique @ [2018-09-12T18:48:54.984Z]: Hi! Let's look over your problem again. Your device does not support chat audio. We need to type. Ready?
JENASIS @ [2018-09-12T18:49:08.059Z]: I need help
Ms. Dominique @ [2018-09-12T18:49:30.761Z]: What two numbers are being compared in this problem?
JENASIS @ [2018-09-12T18:50:05.349Z]: 3 tens and 3 ones
Ms. Dominique @ [2018-09-12T18:50:14.894Z]: that's right
Ms. Dominique @ [2018-09-12T18:50:21.247Z]: What does 3 tens equal?
JENASIS @ [2018-09-12T18:50:34.425Z]: 30
Ms. Dominique @ [2018-09-12T18:50:42.603Z]: that's right
Ms. Dominique @ [2018-09-12T18:50:45.970Z]: What number is 3 ones?
JENASIS @ [2018-09-12T18:50:59.587Z]: 3
Ms. Dominique @ [2018-09-12T18:51:09.435Z]: right
Ms. Dominique @ [2018-09-12T18:51:13.725Z]: How many groups of 3 go into 30?
JENASIS @ [2018-09-12T18:52:18.268Z]: 10
Ms. Dominique @ [2018-09-12T18:52:22.886Z]: that's right!
Ms. Dominique @ [2018-09-12T18:52:29.328Z]: Do you have any questions before you continue on your own?
JENASIS @ [2018-09-12T18:52:52.551Z]: No Thank you
Ms. Dominique @ [2018-09-12T18:53:00.963Z]: Please come back if you need more help. Have a nice day!",0,no,6,Ms. Dominique ,JENASIS ,True,6,True
44,1323,9/12/2018,Dominique Huffman,Grouping Tens and Ones ,94535,"Server Notice @ [2018-09-12T16:29:55.390Z]: This conversation will be saved.
Ms. Dominique @ [2018-09-12T16:29:55.391Z]: Hi! Let's look over your problem again. Your device does not support chat audio. We need to type. Ready?
Ethan @ [2018-09-12T16:30:02.139Z]: Ok
Ms. Dominique @ [2018-09-12T16:30:11.230Z]: How many total pencils does Gerard need ?
Ethan @ [2018-09-12T16:30:20.625Z]: 60
Ms. Dominique @ [2018-09-12T16:30:41.368Z]: Right
Ms. Dominique @ [2018-09-12T16:30:45.079Z]: How many pencils are in each box?
Ethan @ [2018-09-12T16:30:58.830Z]: 10
Ms. Dominique @ [2018-09-12T16:31:05.797Z]: excellent
Ms. Dominique @ [2018-09-12T16:31:09.701Z]: So how many boxes is 60 pencils?
Ethan @ [2018-09-12T16:31:48.145Z]: 6
Ms. Dominique @ [2018-09-12T16:32:01.307Z]: that's right!
Ms. Dominique @ [2018-09-12T16:32:04.165Z]: He already has 20 pencils, how many more does he need to buy to have 60 total?
Ethan @ [2018-09-12T16:32:42.321Z]: 4 more packs?🤔
Ms. Dominique @ [2018-09-12T16:32:53.779Z]: Excellent! How many pencils are in 4 boxes?
Ethan @ [2018-09-12T16:33:22.339Z]: 40! 😃
Ms. Dominique @ [2018-09-12T16:33:29.831Z]: Right!
Ms. Dominique @ [2018-09-12T16:33:31.368Z]: Do you have any questions before you continue on your own?
Ethan @ [2018-09-12T16:34:11.635Z]: No thank u thx!!!
Ms. Dominique @ [2018-09-12T16:34:20.591Z]: Please come back if you need more help. Have a nice day!
Ethan @ [2018-09-12T16:34:35.375Z]: U2",0,no,6,Ms. Dominique ,Ethan ,True,7,True
45,1091,9/19/2018,Dominique Huffman,Decimal Notation II,407800,"Server Notice @ [2018-09-19T17:02:32.963Z]: This conversation will be saved.
Server Notice @ [2018-09-19T17:02:32.963Z]: Your device supports Web RTC audio
Ms. Dominique @ [2018-09-19T17:02:32.964Z]: Hi! Let's look over your problem again. Would you like me to type or talk?
Charlie @ [2018-09-19T17:02:40.772Z]: type
Ms. Dominique @ [2018-09-19T17:02:45.056Z]: ok
Ms. Dominique @ [2018-09-19T17:02:55.255Z]: How can you tell if fractions and decimals are equal to each other?
Charlie @ [2018-09-19T17:04:20.027Z]: I got it
Ms. Dominique @ [2018-09-19T17:04:27.556Z]: Do you have any questions before you continue on your own?
Charlie @ [2018-09-19T17:04:37.530Z]: no
Ms. Dominique @ [2018-09-19T17:04:51.963Z]: Please come back if you need more help. Have a nice day!",0,no,6,Ms. Dominique ,Charlie ,True,3,True
46,6557,9/12/2018,Dominique Huffman,Introduction to Slope,32602,"Server Notice @ [2018-09-12T20:06:24.301Z]: This conversation will be saved.
Server Notice @ [2018-09-12T20:06:24.302Z]: Your device supports Web RTC audio
Ms. Dominique @ [2018-09-12T20:06:24.302Z]: Hi! Let's look over your problem again. Would you like me to type or talk?
Joshua @ [2018-09-12T20:06:33.339Z]: type
Ms. Dominique @ [2018-09-12T20:06:42.527Z]: What do you already know about Slope?
Joshua @ [2018-09-12T20:07:03.492Z]: nothing im confused of all of it
Ms. Dominique @ [2018-09-12T20:07:26.221Z]: Ok well what does the first part of the problem say that 'slope' is equal to?
Joshua @ [2018-09-12T20:07:53.415Z]: change in y and change in x
Ms. Dominique @ [2018-09-12T20:08:09.147Z]: that's right
Ms. Dominique @ [2018-09-12T20:08:28.102Z]: So for the 'change in y'  what is the first number they have listed?
Joshua @ [2018-09-12T20:08:38.630Z]: 3
Ms. Dominique @ [2018-09-12T20:08:44.731Z]: right, and where do you think they got that from?
Joshua @ [2018-09-12T20:08:59.153Z]: from the red line of the chart
Ms. Dominique @ [2018-09-12T20:09:10.621Z]: Right so what point is the '3' from?
Joshua @ [2018-09-12T20:09:28.931Z]: 4
Ms. Dominique @ [2018-09-12T20:10:27.075Z]: right that's the second point, (4,3) right?
Ms. Dominique @ [2018-09-12T20:11:11.932Z]: 3 is the y coordinate of the second point... to find the **change in y** what do you think you'll subtract from 3?
Joshua @ [2018-09-12T20:11:51.306Z]: 4
Ms. Dominique @ [2018-09-12T20:12:04.087Z]: no we need to group the 'y's' together
Joshua @ [2018-09-12T20:12:29.086Z]: but how do you know what the y are
Ms. Dominique @ [2018-09-12T20:12:35.856Z]: Each point is (x, y)
Ms. Dominique @ [2018-09-12T20:12:42.476Z]: Y is the second coordinate of each point
Joshua @ [2018-09-12T20:12:54.214Z]: ok
Joshua @ [2018-09-12T20:12:57.592Z]: so 9
Ms. Dominique @ [2018-09-12T20:13:02.980Z]: Yes very good!
Ms. Dominique @ [2018-09-12T20:13:09.394Z]: So the 'change in y' is 3-9
Ms. Dominique @ [2018-09-12T20:13:16.584Z]: Similarly, how can we find the change in x?
Joshua @ [2018-09-12T20:14:01.359Z]: by 4 and 1
Ms. Dominique @ [2018-09-12T20:14:06.098Z]: Right good
Ms. Dominique @ [2018-09-12T20:14:11.149Z]: Do you have any questions before you continue on your own?
Joshua @ [2018-09-12T20:14:32.765Z]: yes
Ms. Dominique @ [2018-09-12T20:14:56.807Z]: ok what's your question?
Joshua @ [2018-09-12T20:15:24.249Z]: on the last onne i dont understand the part where you have an anwer
Joshua @ [2018-09-12T20:15:28.167Z]: last question'\
Ms. Dominique @ [2018-09-12T20:15:35.499Z]: well what did you get for the second step?
Joshua @ [2018-09-12T20:16:09.871Z]: i got -6 and 3
Joshua @ [2018-09-12T20:16:18.207Z]: but couuldent figure out the rest
Ms. Dominique @ [2018-09-12T20:16:19.727Z]: Exactly
Ms. Dominique @ [2018-09-12T20:16:25.198Z]: and then what does -6/3 equal?
Joshua @ [2018-09-12T20:16:43.694Z]: 2
Joshua @ [2018-09-12T20:16:50.568Z]: or negative 2
Ms. Dominique @ [2018-09-12T20:16:56.023Z]: yes -2 is right :)
Ms. Dominique @ [2018-09-12T20:16:57.639Z]: Please come back if you need more help. Have a nice day!
Joshua @ [2018-09-12T20:17:02.681Z]: ok thank you'",0,no,6,Ms. Dominique ,Joshua ,True,14,True
47,6512,9/4/2018,Dominique Huffman,Visualizing Place Value Relationships,30267,"Server Notice @ [2018-09-04T20:10:22.130Z]: This conversation will be saved.
Ms. Dominique @ [2018-09-04T20:10:22.131Z]: Hi! Let's look over your problem again. Your device does not support chat audio. We need to type. Ready?
Genaro @ [2018-09-04T20:10:33.217Z]: Talk.
Ms. Dominique @ [2018-09-04T20:10:43.271Z]: Your device does not work with my mic for some reason. Let's type!
Genaro @ [2018-09-04T20:10:46.817Z]: Ok
Ms. Dominique @ [2018-09-04T20:10:48.746Z]: What do you already know about Number Models?
Genaro @ [2018-09-04T20:11:25.904Z]: So I don't understand the problem on question 2.
Ms. Dominique @ [2018-09-04T20:11:42.170Z]: Ok so what is the *place value* of the 2 in 24 ?
Genaro @ [2018-09-04T20:12:24.255Z]: The question doesn't make sense for me
Ms. Dominique @ [2018-09-04T20:12:47.416Z]: Let me show you a picture that may help.
Ms. Dominique @ [2018-09-04T20:13:18.197Z]: What number did I model in that picture?
Genaro @ [2018-09-04T20:13:31.365Z]: 35
Ms. Dominique @ [2018-09-04T20:13:43.235Z]: Very good\
Ms. Dominique @ [2018-09-04T20:13:48.012Z]: What is the place value of the 3 in 35 ?
Genaro @ [2018-09-04T20:14:17.192Z]: Oh it's tens
Ms. Dominique @ [2018-09-04T20:14:33.765Z]: Good, and what about the place value of the 5 ?
Genaro @ [2018-09-04T20:15:15.709Z]: Sorry can you wait for a second?
Ms. Dominique @ [2018-09-04T20:15:27.216Z]: ok :)
Genaro @ [2018-09-04T20:16:27.062Z]: I'm here. and I don't understand your question?
Ms. Dominique @ [2018-09-04T20:17:11.430Z]: what is the place value of the 5 in 35 ?
Genaro @ [2018-09-04T20:17:25.375Z]: Ones
Ms. Dominique @ [2018-09-04T20:17:50.199Z]: very good
Ms. Dominique @ [2018-09-04T20:17:51.669Z]: Do you have any questions before you continue on your own?
Genaro @ [2018-09-04T20:18:00.351Z]: Sorry I have to leave
Ms. Dominique @ [2018-09-04T20:18:31.488Z]: Please come back if you need more help. Have a nice day!
Genaro @ [2018-09-04T20:18:42.463Z]: Thank you",46,no,6,Ms. Dominique ,Genaro ,Talk,10,True
48,6297,9/18/2018,Dominique Huffman,Interpreting Division Problems ,4604,"Server Notice @ [2018-09-18T15:53:03.329Z]: This conversation will be saved.
Server Notice @ [2018-09-18T15:53:03.331Z]: Your device supports Web RTC audio
Ms. Dominique @ [2018-09-18T15:53:03.333Z]: Hi! Let's look over your problem again. Would you like me to type or talk?
Isabella @ [2018-09-18T15:53:23.598Z]: type:D
Ms. Dominique @ [2018-09-18T15:53:35.112Z]: What is the total number of apples in this problem?
Isabella @ [2018-09-18T15:53:46.453Z]: 24
Ms. Dominique @ [2018-09-18T15:54:14.121Z]: Right
Ms. Dominique @ [2018-09-18T15:54:19.099Z]: What is the number of apples in each basket?
Isabella @ [2018-09-18T15:54:30.154Z]: 6
Ms. Dominique @ [2018-09-18T15:54:36.858Z]: Very good
Ms. Dominique @ [2018-09-18T15:54:42.220Z]: So what is the number of baskets she needs?
Isabella @ [2018-09-18T15:55:45.318Z]: 4? because 24 divided by 6 is 4 :)
Ms. Dominique @ [2018-09-18T15:55:53.158Z]: Yes that's right!
Ms. Dominique @ [2018-09-18T15:56:09.031Z]: So when you do 24÷6 =  4 ... What does that answer tell you about this problem?
Isabella @ [2018-09-18T15:57:06.852Z]: that she will  need 4 baskets...?
Ms. Dominique @ [2018-09-18T15:57:11.610Z]: Right!
Ms. Dominique @ [2018-09-18T15:57:12.593Z]: Do you have any questions before you continue on your own?
Isabella @ [2018-09-18T15:58:02.117Z]: no, but thanks for your help bye! have a nice day :)
Ms. Dominique @ [2018-09-18T15:58:10.702Z]: Please come back if you need more help. Have a nice day!
Isabella @ [2018-09-18T15:58:24.964Z]: bye:D",0,no,6,Ms. Dominique ,Isabella ,True,6,True
49,6426,9/12/2018,Dominique Huffman,Dividing Whole Numbers - Standard Algorithm,994123,"Server Notice @ [2018-09-12T15:56:05.255Z]: This conversation will be saved.
Ms. Dominique @ [2018-09-12T15:56:05.257Z]: Hi! Let's look over your problem again. Your device does not support chat audio. We need to type. Ready?
Jazmen @ [2018-09-12T15:56:31.118Z]: Hi type and my names is jazmen
Jazmen @ [2018-09-12T15:56:50.558Z]: Ready
Ms. Dominique @ [2018-09-12T15:57:09.403Z]: Have you ever worked with long division before?
Jazmen @ [2018-09-12T15:57:23.800Z]: Yes ma’am I have
Ms. Dominique @ [2018-09-12T15:57:32.129Z]: great
Ms. Dominique @ [2018-09-12T15:57:45.497Z]: You got everything right so far except the remainder 'R'
Ms. Dominique @ [2018-09-12T15:57:49.258Z]: How can you find the remainder ?
Jazmen @ [2018-09-12T15:58:16.616Z]: It is the left over number
Ms. Dominique @ [2018-09-12T15:59:10.151Z]: right, so what's left over at the very end?
Jazmen @ [2018-09-12T15:59:43.599Z]: I got it right thanks for your help
Ms. Dominique @ [2018-09-12T15:59:54.808Z]: Please come back if you need more help. Have a nice day!
Jazmen @ [2018-09-12T16:00:00.256Z]: Bye",0,no,6,Ms. Dominique ,Jazmen ,True,4,True
50,3780,9/11/2018,Meaghan Wright,Dividing Whole Numbers - One-Digit Divisors,4648,"Server Notice @ [2018-09-11T14:43:56.507Z]: This conversation will be saved.
Server Notice @ [2018-09-11T14:43:56.510Z]: Your device supports Web RTC audio
Ms. Meaghan @ [2018-09-11T14:43:56.512Z]: Hi! Let's look over your problem again. Would you like me to type or talk?
trinity @ [2018-09-11T14:44:29.695Z]: type
Ms. Meaghan @ [2018-09-11T14:44:45.271Z]: what are the clubs trying to share?
trinity @ [2018-09-11T14:45:20.517Z]: $435
Ms. Meaghan @ [2018-09-11T14:45:40.819Z]: i see four $100 bills. why did each club only get one of them?
trinity @ [2018-09-11T14:47:00.319Z]: so they could all get one equally?
Ms. Meaghan @ [2018-09-11T14:47:07.652Z]: Okay, so what are we going to do with the extra $100 bill so we can be fair?
trinity @ [2018-09-11T14:47:48.154Z]: we can divide it.
Ms. Meaghan @ [2018-09-11T14:48:04.545Z]: How?
trinity @ [2018-09-11T14:49:02.052Z]: by splitting it into 3 groups.
Ms. Meaghan @ [2018-09-11T14:49:43.414Z]: do you mean you're going to cut up the bill into smaller pieces with scissors?
trinity @ [2018-09-11T14:51:32.501Z]: oh i gotta go my teacher is saying to switch rotations, bye! :)
Ms. Meaghan @ [2018-09-11T14:51:46.054Z]: Please come back if you need more help. Have a nice day!",0,no,6,Ms. Meaghan ,trinity ,True,6,True
51,6979,9/17/2018,Meaghan Wright,Decimal Notation II,94078,"Server Notice @ [2018-09-17T22:38:32.296Z]: This conversation will be saved.
Ms. Meaghan @ [2018-09-17T22:38:32.298Z]: Hi! Let's look over your problem again. Your device does not support chat audio. We need to type. Ready?
Kurt @ [2018-09-17T22:38:39.491Z]: Yes
Ms. Meaghan @ [2018-09-17T22:38:51.149Z]: please tell me with words; how much money is $0.02 ?
Kurt @ [2018-09-17T22:39:31.504Z]: 2
Ms. Meaghan @ [2018-09-17T22:39:42.267Z]: How much money is it?
Kurt @ [2018-09-17T22:40:22.302Z]: 2 cents
Ms. Meaghan @ [2018-09-17T22:40:44.359Z]: Right! what *fraction* of a dollar does it represent?
Kurt @ [2018-09-17T22:41:24.913Z]: 2 hundreths
Ms. Meaghan @ [2018-09-17T22:41:37.940Z]: Right! What does that look like as a fraction?
Kurt @ [2018-09-17T22:42:30.591Z]: Two over one Hundred
Ms. Meaghan @ [2018-09-17T22:42:48.691Z]: Right! :) so 0.02 is same as 2 out of 100 or 2 / 100, does that make sense?
Kurt @ [2018-09-17T22:43:18.223Z]: No
Ms. Meaghan @ [2018-09-17T22:43:28.392Z]: What is still confusing you?
Kurt @ [2018-09-17T22:44:17.027Z]: How to Place it on a chart
Ms. Meaghan @ [2018-09-17T22:44:43.557Z]: Is this true: 0.02 = 2/100
Kurt @ [2018-09-17T22:44:54.986Z]: Yes
Ms. Meaghan @ [2018-09-17T22:45:10.416Z]: Great! What about this: 0.03 = 3/10
Kurt @ [2018-09-17T22:46:04.174Z]: No, I get it now
Ms. Meaghan @ [2018-09-17T22:46:11.753Z]: Please come back if you need more help. Have a nice day!
Kurt @ [2018-09-17T22:46:12.163Z]: Thank you",0,no,6,Ms. Meaghan ,Kurt ,True,9,True
52,7299,8/23/2018,Meaghan Wright,Place Value Relationships Within Whole Numbers and Decimals,4272,"Server Notice @ [2018-08-23T23:14:28.461Z]: This conversation will be saved.
Ms. Meaghan @ [2018-08-23T23:14:28.462Z]: Hi! Let's look over your problem again. Your device does not support chat audio. We need to type. Ready?
Yosdany @ [2018-08-23T23:14:41.534Z]: ok
Ms. Meaghan @ [2018-08-23T23:14:53.230Z]: What does this problem ask you to find? :)
Yosdany @ [2018-08-23T23:15:36.257Z]: how many times does ten time 100 or ten  to the awnser
Yosdany @ [2018-08-23T23:15:44.538Z]: i think its ten
Ms. Meaghan @ [2018-08-23T23:15:45.715Z]: what two things are we comparing in this problem?
Yosdany @ [2018-08-23T23:16:01.776Z]: i th ink its ten
Yosdany @ [2018-08-23T23:16:20.592Z]: 2 in tens and 2 in hundread
Ms. Meaghan @ [2018-08-23T23:16:55.348Z]: Okay, so what numbers are we comparing then? :)
Yosdany @ [2018-08-23T23:17:19.979Z]: 2 in tens and 2 in hundreads
Ms. Meaghan @ [2018-08-23T23:17:31.127Z]: Yes, what numbers is that?
Yosdany @ [2018-08-23T23:17:38.118Z]: 10
Ms. Meaghan @ [2018-08-23T23:17:48.243Z]: 2 tens  is what number
Yosdany @ [2018-08-23T23:18:04.023Z]: i got it correct its the fraction
Ms. Meaghan @ [2018-08-23T23:18:08.960Z]: Please come back if you need more help. Have a nice day!",0,no,6,Ms. Meaghan ,Yosdany ,True,6,True
53,1416,9/10/2018,Meaghan Wright,Subtracting Fractions ,4242,"Server Notice @ [2018-09-10T22:34:07.973Z]: This conversation will be saved.
Ms. Meaghan @ [2018-09-10T22:34:07.974Z]: Hi! Let's look over your problem again. Your device does not support chat audio. We need to type. Ready?
Melanie @ [2018-09-10T22:34:17.562Z]: yes
Ms. Meaghan @ [2018-09-10T22:34:34.409Z]: What does this problem ask you to find? :)
Melanie @ [2018-09-10T22:35:55.968Z]: its asking for you to solve the problem, but im having trouble with the bottem denomonators because they are not the same.
Ms. Meaghan @ [2018-09-10T22:36:10.433Z]: Right! So what has to happen before we can subtract here?
Melanie @ [2018-09-10T22:36:39.441Z]: you have to find the lowest commen denomonator.
Ms. Meaghan @ [2018-09-10T22:37:16.491Z]: Okay, let's look at an example on the whiteboard. Ready?
Melanie @ [2018-09-10T22:37:29.658Z]: yes
Ms. Meaghan @ [2018-09-10T22:38:11.043Z]: What is a common denominator that we could have here?
Melanie @ [2018-09-10T22:38:25.286Z]: 6?
Ms. Meaghan @ [2018-09-10T22:38:36.830Z]: Great! So then will we need to do anything right now with 2 1/6?
Melanie @ [2018-09-10T22:38:56.330Z]: yeah
Ms. Meaghan @ [2018-09-10T22:38:59.444Z]: Why?
Melanie @ [2018-09-10T22:39:58.235Z]: because you cant have your denomonator as 6 and you have to do more, but im not sure wgat to do...
Melanie @ [2018-09-10T22:40:16.225Z]: *what
Ms. Meaghan @ [2018-09-10T22:40:22.346Z]: But you told me that a common denominator here would be 6, right?
Melanie @ [2018-09-10T22:40:34.265Z]: yes
Ms. Meaghan @ [2018-09-10T22:41:00.972Z]: Right, so we can leave 2 1/6 alone right now :) Take a look at 1 2/3, how will we change that to have a denominator of 6?
Melanie @ [2018-09-10T22:41:45.208Z]: not sure
Ms. Meaghan @ [2018-09-10T22:42:04.562Z]: Look at 2/3, what will you need to do with the 3 to get to a 6?
Melanie @ [2018-09-10T22:42:57.880Z]: multipy?
Ms. Meaghan @ [2018-09-10T22:43:19.674Z]: Great! What would you multipy by?
Melanie @ [2018-09-10T22:43:37.435Z]: 6?
Ms. Meaghan @ [2018-09-10T22:43:49.701Z]: 3 × 6 = 6?
Melanie @ [2018-09-10T22:44:28.416Z]: 3 x 6 = 18
Ms. Meaghan @ [2018-09-10T22:44:51.203Z]: Yes, so then 3 × ■ = 6?
Melanie @ [2018-09-10T22:45:14.921Z]: 3 x 3 = 9
Ms. Meaghan @ [2018-09-10T22:45:35.047Z]: That does not answer my question, please read it carefully :)
Melanie @ [2018-09-10T22:45:50.274Z]: oh
Melanie @ [2018-09-10T22:46:53.805Z]: 3 x 2 = 6, so dose that mean your new denomonator is 2??
Ms. Meaghan @ [2018-09-10T22:47:11.388Z]: The new denominator is 6, but you *multiplied by 2*
Ms. Meaghan @ [2018-09-10T22:47:50.487Z]: Do you see how the problem changes once the denominators change?
Melanie @ [2018-09-10T22:47:52.052Z]: ohhhhhh
Ms. Meaghan @ [2018-09-10T22:47:56.932Z]: See if you can use what we did to try this on your own. Please come back if you need more help. Have a nice day!",97,no,6,Ms. Meaghan ,Melanie ,True,15,True
54,4545,9/11/2018,Meaghan Wright,Concept of Division ,4049,"Server Notice @ [2018-09-11T14:50:33.379Z]: This conversation will be saved.
Server Notice @ [2018-09-11T14:50:33.379Z]: Your device supports Web RTC audio
Ms. Meaghan @ [2018-09-11T14:50:33.380Z]: Hi! Let's look over your problem again. Would you like me to type or talk?
Jeremiah @ [2018-09-11T14:50:53.467Z]: talk
Ms. Meaghan @ [2018-09-11T14:51:13.452Z]: Did you hear my voice?
Jeremiah @ [2018-09-11T14:51:16.873Z]: -yes
Jeremiah @ [2018-09-11T14:51:30.389Z]: 9
Jeremiah @ [2018-09-11T14:51:44.377Z]: 5
Jeremiah @ [2018-09-11T14:51:48.634Z]: 15
Jeremiah @ [2018-09-11T14:52:11.025Z]: put them on shevles
Jeremiah @ [2018-09-11T14:52:26.273Z]: 3
Jeremiah @ [2018-09-11T14:53:15.533Z]: it shows a picture
Ms. Meaghan @ [2018-09-11T14:54:47.827Z]: Are you still there?
Jeremiah @ [2018-09-11T14:55:01.292Z]: yes
Jeremiah @ [2018-09-11T14:56:18.527Z]: becaus if youn had wax that they yous  at harri salon that they do to boys and you had 5 -2=3
Jeremiah @ [2018-09-11T14:56:52.502Z]: 5-2=3
Jeremiah @ [2018-09-11T14:57:18.641Z]: you ther
Jeremiah @ [2018-09-11T14:57:30.683Z]: you ok
Ms. Meaghan @ [2018-09-11T14:57:35.642Z]: i spoke. please answer my question, or let me know if you did not hear me.
Jeremiah @ [2018-09-11T14:58:49.078Z]: this is his mom is he not doing is work he cant hear you
Ms. Meaghan @ [2018-09-11T14:59:17.584Z]: I'll type instead, okay? :)
Jeremiah @ [2018-09-11T14:59:53.623Z]: ok this is his mom
Ms. Meaghan @ [2018-09-11T15:00:33.284Z]: what *math operation* helps us **split** something into equal size amounts?
Jeremiah @ [2018-09-11T15:01:06.829Z]: by by uh
Ms. Meaghan @ [2018-09-11T15:01:13.412Z]: Please give it a try! It is okay to make mistakes.
Jeremiah @ [2018-09-11T15:01:23.024Z]: got  to get waxed
Ms. Meaghan @ [2018-09-11T15:01:31.708Z]: I would like to help you. Are you ready to work on this together?
Jeremiah @ [2018-09-11T15:01:50.623Z]: yes
Ms. Meaghan @ [2018-09-11T15:01:56.417Z]: what *math operation* helps us **split** something into equal size amounts?
Jeremiah @ [2018-09-11T15:02:23.937Z]: by by by by by by by by by by by b y by by by by by by by
Ms. Meaghan @ [2018-09-11T15:02:34.108Z]: I am sorry that you do not want to work with me. Please come back when you are ready.",0,no,6,Ms. Meaghan ,Jeremiah ,talk,9,True
55,5690,9/18/2018,Meaghan Wright,Operations with Whole Numbers - Mixed Practice ,70527,"Server Notice @ [2018-09-18T18:46:34.281Z]: This conversation will be saved.
Server Notice @ [2018-09-18T18:46:34.282Z]: Your device supports Web RTC audio
Ms. Meaghan @ [2018-09-18T18:46:34.283Z]: Hi! Let's look over your problem again. Would you like me to type or talk?
WAYLON @ [2018-09-18T18:46:44.034Z]: type plaese
Ms. Meaghan @ [2018-09-18T18:47:05.540Z]: why are you buying cases of water according to this story?
WAYLON @ [2018-09-18T18:47:18.454Z]: 12450
Ms. Meaghan @ [2018-09-18T18:47:22.712Z]: ?
WAYLON @ [2018-09-18T18:47:26.074Z]: 150 i eant
Ms. Meaghan @ [2018-09-18T18:47:31.130Z]: Please answer my question so I can help you with this problem :)
WAYLON @ [2018-09-18T18:48:12.597Z]: 24 bottles in each case and there 150 bottles of water
Ms. Meaghan @ [2018-09-18T18:48:27.337Z]: But why are you buying cases of water
WAYLON @ [2018-09-18T18:48:45.442Z]: for a school evntee
WAYLON @ [2018-09-18T18:48:49.719Z]: event*
Ms. Meaghan @ [2018-09-18T18:49:02.951Z]: Right. what if, for example, you need 20 pencils for school. if they are sold in boxes of 5, how many boxes would you buy?
WAYLON @ [2018-09-18T18:49:11.597Z]: 4
WAYLON @ [2018-09-18T18:49:20.299Z]: easy
Ms. Meaghan @ [2018-09-18T18:49:21.558Z]: how did you use the 20 and 5 to GET 4?
WAYLON @ [2018-09-18T18:49:53.852Z]: oh i that i had to divde 20 and 5
Ms. Meaghan @ [2018-09-18T18:50:24.369Z]: Right! Did you know that you can use that same thinking here?
WAYLON @ [2018-09-18T18:50:56.143Z]: i can?!
Ms. Meaghan @ [2018-09-18T18:51:13.259Z]: Yep! See if you can use what we did to try this on your own. Please come back if you need more help. Have a nice day!",0,no,6,Ms. Meaghan ,WAYLON ,True,8,True
56,443,9/11/2018,Meaghan Wright,Visualizing Addition,30225,"Server Notice @ [2018-09-11T14:31:37.417Z]: This conversation will be saved.
Server Notice @ [2018-09-11T14:31:37.418Z]: Your device supports Web RTC audio
Ms. Meaghan @ [2018-09-11T14:31:37.419Z]: Hi! Let's look over your problem again. Would you like me to type or talk?
Lupita @ [2018-09-11T14:31:51.792Z]: yes
Ms. Meaghan @ [2018-09-11T14:31:54.912Z]: What does this problem ask you to find? :)
Lupita @ [2018-09-11T14:34:20.679Z]: drag each picture to the matching statment
Ms. Meaghan @ [2018-09-11T14:34:39.906Z]: Right! :) What does the first category say?
Lupita @ [2018-09-11T14:37:32.299Z]: the two plates have the same number of apples
Ms. Meaghan @ [2018-09-11T14:37:49.427Z]: Right! How many answer choices do you see that fit that description?
Lupita @ [2018-09-11T14:38:09.819Z]: 3
Ms. Meaghan @ [2018-09-11T14:38:37.652Z]: Take another look :)
Lupita @ [2018-09-11T14:38:55.272Z]: 4
Ms. Meaghan @ [2018-09-11T14:39:17.948Z]: There are a total of 4 answer choices, but do all four have the same number of apples on each plate?
Lupita @ [2018-09-11T14:39:41.443Z]: no
Ms. Meaghan @ [2018-09-11T14:39:58.859Z]: Right, how many of the answer choices do have the same number of apples on each plate?
Lupita @ [2018-09-11T14:40:42.595Z]: 12
Ms. Meaghan @ [2018-09-11T14:41:18.897Z]: I see that you have one choice that has 3 apples on each plate, how did you know that was correct?
Lupita @ [2018-09-11T14:42:31.666Z]: i thinked about it
Ms. Meaghan @ [2018-09-11T14:42:49.688Z]: Do you see that **each plate** in that choice has the *same* number?
